pagina,titulo,precio_min,precio_max,precio_promedio,moneda,proveedor,ventas,rating,link
2,"Traje de baño de una pieza para mujer, traje de baño Sexy Monokini para mujer, Bikini 2020 con cuentas transparentes en las correas ajustables",2.49,5.99,4.24,USD,"Shenzhenshi Jianyiyi Apparel Co.,Ltd.",124 vistas,4.7/5.0 (129),https://www.alibaba.com/product-detail/Women-Swimwear-One-Piece-Swimsuit-Sexy_62504486654.html
2,2025 traje de baño con bufanda de una pieza de traje de baño de mujer traje de baño a rayas ropa de playa,12.59,13.59,13.09,USD,"Xiamen Jiubaju Network Technology Co., Ltd.",51 vendidos,4.3/5.0 (328),https://www.alibaba.com/product-detail/2025-Swimsuit-With-Scarf-One-Piece_1601414217479.html
2,Traje de baño de talla grande 5x Sujetador abierto Sexy Un hombro Tallas grandes Xxxxl Bikinis para mujeres gordas Conjunto de 2 piezas Ropa de playa Traje de baño de chica sexy,4.5,9.9,7.2,USD,Zhongshan Hongbao Fashion Company Limited,60 vendidos,5.0/5.0 (1),https://www.alibaba.com/product-detail/Plus-Size-Swimwear-5x-Open-Bra_1601406351010.html
2,"Conjunto de Bikini con cordones, traje de baño Floral para mujer, traje de baño con Tanga triangular, Etiqueta Privada, nuevo para mujer, Bikinis personalizados 2023",3.8,12.88,8.34,USD,"Guangzhou Outpace Sportswear Co., Ltd.",10 vendidos,4.9/5.0 (87),https://www.alibaba.com/product-detail/Lace-up-Bikini-Set-Bathing-Suit_1601052503798.html
2,Factory Fitness traje de baño de una pieza traje de baño de talla grande traje de baño Sexy personalizado ropa de playa sexy casual,7.47,13.39,10.43,USD,"Xiamen Heailun Clothing Co., Ltd.",11 vendidos,4.3/5.0 (61),https://www.alibaba.com/product-detail/Factory-Fitness-Swimwear-One-Piece-Swimsuit_1600780421615.html
2,2025 Halter Bikini conjunto traje de baño corto Mujer cintura alta traje de baño femenino estampado bañistas natación traje de baño ropa de playa,4.72,4.72,4.72,USD,"Shenzhen Yuwei Trading Co., Ltd.",16 vendidos,4.5/5.0 (94),https://www.alibaba.com/product-detail/2025-Halter-Bikini-Set-Short-Swimsuit_1600876028223.html
2,"Traje de baño estampado Sexy de moda para mujer, ropa de baño de vacaciones tropicales, traje de baño de Venta caliente para mujer",8.43,8.43,8.43,USD,"Quanzhou Dazhong Import And Export Co., Ltd.",3 vendidos,4.8/5.0 (116),https://www.alibaba.com/product-detail/Fashionable-Sexy-Printed-Bathing-Suit-Women_1601389740992.html
2,Traje de baño personalizado Ropa de playa Bikinis y ropa de playa Fabricante de trajes de baño Ropa de playa Bikinis Trajes de baño,4.0,4.0,4.0,USD,INFLOW SPORTS,No info,4.9/5.0 (13),https://www.alibaba.com/product-detail/Customized-Swimwear-Beachwear-Bikinis-Beachwear-Swimwear_10000024515909.html
2,Mujeres Body Trajes de baño Venta al por mayor 3 piezas Bikini Traje de baño Ropa de playa Cubrir Sarong Tie up Set Swimsuitbikini Traje de baño,4.81,4.81,4.81,USD,"Huzhou Jindou Network Technology Co., Ltd.",1 vendido,4.3/5.0 (236),https://www.alibaba.com/product-detail/Women-Bodysuit-Bathing-Suits-Wholesale-3_1601421661502.html
2,"Yingfa-bañador de una pieza para mujer, ropa de baño a escala de pescado, entrenamiento de competición, sin almohadillas para el pecho, 925",20.0,20.0,20.0,USD,"Yiwu Jinlang Sports Goods Co., Ltd.",37 vistas,4.8/5.0 (3),https://www.alibaba.com/product-detail/Yingfa-925-Women-s-One-piece_1600619770232.html
2,"Bañador de una pieza de corte alto para mujer 3007 con estampado de doble cara, Bikini de playa Sexy, traje de baño de secado rápido transpirable para mujer",7.86,7.86,7.86,USD,"Yiwu Pamo Nisi Trading Co., Ltd.",4 vendidos,4.9/5.0 (24),https://www.alibaba.com/product-detail/3007-Women-s-High-Cut-One_1601154475327.html
2,Aide New Push up Traje de baño Sexy Bikini de cintura alta Dos piezas Color degradado Traje de baño para mujer,6.0,8.5,7.25,USD,"Jinjiang Aide Fashion Co., Ltd.",15 vendidos,5.0/5.0 (7),https://www.alibaba.com/product-detail/Aide-New-Push-up-Swimwear-Sexy_1601095796207.html
2,"Bañador de secado rápido para mujer, traje de baño Sexy de alta gama, novedad",4.6,5.8,5.2,USD,"Xiamen Lulushining Apparel Co., Ltd",120 vendidos,4.6/5.0 (2),https://www.alibaba.com/product-detail/New-High-end-Listing-Quick-Dry_1600469719084.html
2,YY5581 Bikini 2025 cintura alta caliente Micro venta al por mayor nueva moda mujer alta calidad Sexy conjunto traje de baño Bikini,6.5,6.5,6.5,USD,"Foshan Sweetsecretly Apparel Co., Ltd.",2 vendidos,No rating,https://www.alibaba.com/product-detail/YY5581-Bikini-2025-High-Waist-Hot_1600248135507.html
3,Precio bajo Liquidación Traje de baño de dos piezas Traje de baño de moda Conjunto de Bikini sexy Bikini de cintura alta Traje de baño de mujer Enviado al azar,0.1,0.99,0.55,USD,Fuzhou High-Tech Zone Yujian Clothing Firm (individual Business),1 vendido,4.7/5.0 (120),https://www.alibaba.com/product-detail/Low-Price-Clearance-Two-piece-Swimsuit_1601291997452.html
3,Traje de baño de Carnaval 2025 moda caliente Bikini traje de baño personalizado nueva tendencia ropa de playa OEM mujeres Bikini conjunto Push up ropa de baño,5.72,5.72,5.72,USD,"Shangrao Ouling Clothing Co., Ltd.",99 vendidos,4.4/5.0 (40),https://www.alibaba.com/product-detail/Carnival-Swimwear-2025-Fashion-Hot-Bikini_1601017645588.html
3,Popular 2 uds Sexy Color sólido Bikini mujer Tanga Lencería traje de baño sin tirantes Biquini natación playa desgaste Bikinis traje de baño conjunto,0.83,1.03,0.93,USD,"Shaoxing Zhe Zhu Import And Export Co., Ltd.",2 vendidos,4.1/5.0 (1494),https://www.alibaba.com/product-detail/Popular-2pcs-Sexy-Solid-Color-Bikini_1601136476684.html
3,Breathable Swimsuits Swimwear Ladies Custom Bikini Set Print New Wholesales OEM Sexy Trend Women OEM Service Adults 2 Piece Set,15.0,15.0,15.0,USD,"Shenzhen Ananda Trading Co., Ltd.",5 vendidos,5.0/5.0 (3),https://www.alibaba.com/product-detail/Breathable-Swimsuits-Swimwear-Ladies-Custom-Bikini_1601362201440.html
3,"Conjunto de dos piezas de Bikini para mujer y niña, traje de baño Sexy con estampado de leopardo, Bikini de playa",5.3,5.3,5.3,USD,"Shenzhen Ou Fashion Imp. & Exp. Co., Ltd.",1 vendido,4.3/5.0 (2296),https://www.alibaba.com/product-detail/New-Fashion-Women-Girls-Summer-Sexy_62262007913.html
3,Logotipo personalizado de fábrica Mujeres 2 piezas Tops Traje de baño String Micro Bikini Set Tanga Mini Bikinis,1.99,3.99,2.99,USD,"Guangzhou Ifree Garment Co., Ltd.",254 vendidos,4.8/5.0 (7),https://www.alibaba.com/product-detail/Factory-Custom-Logo-Women-2-Piece_1601014910163.html
3,Traje de baño de dos piezas para mujer bikini sexy cárdigan de tres piezas traje de baño de playa de vacaciones de aguas termales,3.31,3.31,3.31,USD,"Yiwu Qilang Sporting Goods Co., Ltd.",4 vendidos,5.0/5.0 (4),https://www.alibaba.com/product-detail/Swimsuit-Women-s-Two-piece-Bikini_1601080755219.html
3,Venta directa de fábrica Traje de baño deportivo de una pieza con cremallera Traje de baño de surf de manga larga para mujer,8.57,8.57,8.57,USD,"Quanzhou Dazhong Import And Export Co., Ltd.",163 vendidos,4.8/5.0 (116),https://www.alibaba.com/product-detail/Factory-Direct-Sale-One-Piece-Zipper_1601175019729.html
3,Nueva llegada Yifeng Swim traje de baño Ropa de playa Bikinis Ropa de playa Traje de baño Ropa de playa,5.99,9.99,7.99,USD,"Hangzhou Fuyang Yifeng Garment Co., Ltd.",503 vendidos,4.8/5.0 (24),https://www.alibaba.com/product-detail/New-Arrival-Yifeng-Swim-Swimsuit-Swimwear_1601242489254.html
3,"1,88 Dollar Model WKF005 Trajes de baño Estilos surtidos Traje de baño de dos piezas Bikini Ropa de playa Traje de baño para dama",2.15,2.15,2.15,USD,"Yiwu Deyu Garment Co., Ltd.",No info,4.1/5.0 (84),https://www.alibaba.com/product-detail/1-88-Dollar-Model-WKF005-Swimsuits_1601082117840.html
3,Nueva tendencia Ropa de playa de manga larga Push up Traje de baño de dos piezas de corte alto Traje de baño,7.29,7.29,7.29,USD,"Xiamen Zheerren Trading Co., Ltd.",No info,4.5/5.0 (250),https://www.alibaba.com/product-detail/New-Trend-Long-Sleeve-Beachwear-Push_1600890108471.html
3,Moda colores cuerda trenzada brasileño Bikini traje de baño conjunto Bikinis y ropa de playa traje de baño mujer ropa de playa chica Bikini traje de baño,7.19,7.19,7.19,USD,"Xiamen Sportex Trading Co., Ltd.",2 vendidos,4.7/5.0 (16),https://www.alibaba.com/product-detail/Fashion-Colors-Braided-Rope-Brazilian-Bikini_1600885244768.html
3,2025 nuevo diseño personalizado traje de baño femenino traje de baño mujer moda ropa de playa traje de baño,5.99,6.99,6.49,USD,"Liaoning Yituo Garment Co., Ltd.",20 vendidos,4.9/5.0 (10),https://www.alibaba.com/product-detail/2025-New-Custom-Design-Female-Bathing_1601156071178.html
3,Traje de baño para mujer Bikini personalizado con parches bordados Bikini de cintura alta Traje de baño Ropa de playa Conjunto de bikini de dos piezas 2024,9.99,12.99,11.49,USD,"Dongguan City Jingyu Apparel Co., Ltd.",161 vendidos,4.8/5.0 (15),https://www.alibaba.com/product-detail/Womens-Swimwear-Customized-Bikini-With-Embroidered_1601109903311.html
3,Traje de baño de una pieza Mujeres Deportes Europeo y Americano Sexy Tallas grandes Bikini Traje de baño,4.7,4.7,4.7,USD,"Yiwu City New Swimmer Clothing Co., Ltd.",77 vendidos,4.8/5.0 (20),https://www.alibaba.com/product-detail/One-Piece-Swimsuit-Women-Sports-European_1601168478217.html
3,2021 verano Mujer traje de baño 3 piezas traje de baño Tie Dye Bikini Sexy con volantes playa cubrir Pantalones,3.9,5.5,4.7,USD,"Xiamen Aimeee Garment Co., Ltd.",42 vendidos,4.8/5.0 (25),https://www.alibaba.com/product-detail/2021-Summer-Woman-Swimwear-3-Piece_1600251432529.html
3,"Muestra gratis de trajes de baño resistentes al desgaste, traje de baño personalizable para niños, traje de baño cómodo para niños y niñas",1.98,5.98,3.98,USD,"Quanzhou Aiguli Tiantian Clothing Co., Ltd.",No info,No rating,https://www.alibaba.com/product-detail/Free-Sample-Wear-resisting-Bathing-Suits_1601224644073.html
3,"Bañador de una pieza con cuello Halter para mujer, traje de baño de talla grande",4.82,5.61,5.21,USD,"Dongguan Fanco Dark Matter Technology Co., Ltd.",11 vendidos,4.9/5.0 (15),https://www.alibaba.com/product-detail/Hot-Selling-Swim-Suit-Monokini-Bathing_1600691528238.html
3,Fabricantes personalizados de talla grande traje de baño de las mujeres traje de baño gran oferta de impresión personalizada trajes de baño sin espalda de dos piezas chica Bikini,6.45,6.45,6.45,USD,"Dongguan Wonderful Sporting Goods Co., Limited",10 vistas,4.7/5.0 (24),https://www.alibaba.com/product-detail/Manufacturers-Customized-Plus-Size-Swimsuit-Women_1601104594686.html
3,2024 Split Ladies traje de baño Color sólido tela Color sólido traje de baño verano Sexy Ladies Bikini,5.92,5.92,5.92,USD,"Hangzhou Deep Love Technology Co., Ltd.",27 vendidos,4.7/5.0 (50),https://www.alibaba.com/product-detail/2024-Split-Ladies-Swimwear-Solid-Color_1601199107350.html
3,Ropa XS 2025 verano Mujer traje de baño estampado de leopardo traje de baño ropa de playa Sexy 3 uds Bikini conjunto trajes de baño para mujer,7.06,7.06,7.06,USD,"Xiamen Fengway Imp. & Exp. Co., Ltd.",351 vendidos,4.5/5.0 (119),https://www.alibaba.com/product-detail/XS-Clothes-2025-Summer-Female-Swimsuit_1601391446865.html
3,Traje de baño de playa de aguas termales para niños Traje de baño de dibujos animados de moda para niños Traje de baño de secado rápido para niños,4.99,4.99,4.99,USD,"Changsha Xinti Trading Co., Ltd.",30 vendidos,4.5/5.0 (54),https://www.alibaba.com/product-detail/Children-s-Hot-Spring-Beach-Swimming_1601155347749.html
3,"Traje de baño sexy para mujer, traje de baño femenino, conjunto de Bikini para mujer, ropa de playa para nadar, traje de baño",1.86,1.86,1.86,USD,"Shijiazhuang Aofeite Imp & Exp Co., Ltd.",20 vendidos,4.7/5.0 (183),https://www.alibaba.com/product-detail/Women-Sexy-Swimsuit-Female-Swimwear-Women_1600374582047.html
3,Traje de baño de 2 piezas de verano para mujer Bikini Beach Swimwear Cover up Set,9.11,9.11,9.11,USD,"Yiwu Yajing Trade Co., Ltd.",48 vendidos,4.1/5.0 (21),https://www.alibaba.com/product-detail/Women-s-Summer-2-Piece-Swimsuit_1601169034374.html
3,Nuevo traje de baño Bikini multicolor Sexy Tankini Ladies Swimsuit,5.87,5.87,5.87,USD,"Xinxiang Baiyin Clothing Co., Ltd.",No info,4.6/5.0 (11),https://www.alibaba.com/product-detail/New-Swimwear-Multi-Color-Bikini-Sexy_1601385350729.html
3,Conjunto de bikini de color de playa de traje de baño caliente sexy de mujer al por mayor barato,4.5,4.5,4.5,USD,"Xuzhou Yangguang Beauty Co., Ltd.",3 vendidos,4.8/5.0 (14),https://www.alibaba.com/product-detail/Cheap-Wholesale-Women-s-Sexy-Hot_1601280259187.html
3,Venta caliente al por mayor logotipo personalizado de una pieza Shapewear traje de baño ropa de playa mujeres Fitness traje de baño ropa de playa,3.25,10.26,6.75,USD,"Xiamen Hexin Supply Chain Management Co., Ltd.",42 vendidos,4.8/5.0 (79),https://www.alibaba.com/product-detail/HOT-SALE-Wholesale-Custom-Logo-One_1600747676189.html
3,Personalizado de alta calidad Sexy Tallas grandes Bikinis Ser traje de baño para las mujeres Floral Bikini Set Cintura alta Tallas grandes Traje de baño Ropa de playa,5.1,9.9,7.5,USD,Zhongshan Hongbao Fashion Company Limited,50 vendidos,5.0/5.0 (1),https://www.alibaba.com/product-detail/Custom-Hight-Quality-Sexy-Plus-Size_1601415922392.html
3,Venta al por mayor nueva moda Venta caliente Tallaje grande Bikini Personalizado de dos piezas Crop Top de manga corta Traje de baño,5.3,10.2,7.75,USD,"Dongguan Huilin Apparel Co., Ltd.",48 vistas,4.1/5.0 (4),https://www.alibaba.com/product-detail/Wholesale-New-Fashion-Hot-Selling-Plus_1601153240735.html
3,Traje de baño de entrenamiento del fabricante Venta caliente Traje de baño de una pieza para mujer Protector solar de malla multicolor con logotipo Cintura Patrón de estampado fresco y sexy,10.9,10.9,10.9,USD,"Huludao Sifu Garment Co., Ltd.",No info,5.0/5.0 (2),https://www.alibaba.com/product-detail/training-swimsuit-Manufacturer-s-Hot-Selling_1601422627049.html
3,Traje de baño de bikini de ganchillo sexy para mujer con top y pantalones de playa ahuecados de Concha-Patrón de punto a rayas para adultos,2.4,5.2,3.8,USD,"Shijiazhuang Peige Trade Co., Ltd.",30 vendidos,4.8/5.0 (167),https://www.alibaba.com/product-detail/Women-s-Sexy-Crochet-Bikini-Swimsuit_62504947727.html
3,"ZSYJ-e3403 de baño de tela reciclada para mujer, Mini bañador de diseño, sexy, respetuoso con el medio ambiente, gran oferta",5.26,5.26,5.26,USD,"Dongguan Lanteng Sports Products Co., Ltd.",10 vendidos,4.8/5.0 (12),https://www.alibaba.com/product-detail/ZSYJ-e3403-Recycled-Fabric-Swimwear-Hot_1600218915856.html
3,"Traje de baño de tamaño personalizado para mujer 2025, ropa de playa, gran oferta, colección de verano, sujetador transpirable sin costuras, estampado, traje de baño personalizado con logotipo",5.0,11.5,8.25,USD,"Quanzhou Minghe Apparel Co., Ltd.",No info,4.9/5.0 (11),https://www.alibaba.com/product-detail/2025-Women-s-Custom-Size-Swim_1601323943343.html
3,Traje de baño de mujer de manga larga de punto Vestido de playa espalda abierta caftán 3 piezas traje de baño Tanga Bikini,5.99,6.99,6.49,USD,RUIMART STORES LTD,No info,No rating,https://www.alibaba.com/product-detail/Women-Swimwear-Long-Sleeve-Knit-Beach_1601172065901.html
3,"Traje de baño de Estilo Vintage para mujer, conjunto de natación con correa ajustable, ropa de baño, bañistas de 1 pieza para mujer",6.13,6.13,6.13,USD,"Zhumadian Economic Development Zone Qianyuan Trading Co., Ltd.",1 vendido,4.4/5.0 (329),https://www.alibaba.com/product-detail/Women-s-Vintage-Style-Swimwear-Bodysuit_1601377629607.html
3,2025 sólido mujeres cintura baja Sexy Bikinis conjuntos traje de baño transpirable secado rápido moda Breach natación traje de baño,4.45,4.45,4.45,USD,"Shenzhen Mesbang Technology Co., Ltd.",1 vendido,4.9/5.0 (1),https://www.alibaba.com/product-detail/2025-Solid-Women-Low-Waist-Sexy_1601398917307.html
3,"Ikini IRL, ropa de invierno",4.98,4.98,4.98,USD,"Dongguan Luyin Sports Products Co., Ltd.",No info,4.9/5.0 (85),https://www.alibaba.com/product-detail/High-Quality-Swim-Suits-18-Teen_1600801175929.html
3,"Conjunto de traje de baño de Bikini brasileño Rosa informal para mujer, traje de baño de playa de competición de verano estilo volantes para adultos, conjunto de 2 piezas",1.99,2.39,2.19,USD,"Ningbo Mdbay Apparel Co., Ltd.",No info,4.7/5.0 (6),https://www.alibaba.com/product-detail/Women-s-Casual-Pink-Brazilian-Bikini_62299793467.html
3,Directo de fábrica ropa de playa bikini traje de baño marcas bikinis diseñador trajes de baño ropa al por mayor,1.9,1.9,1.9,USD,"Quanzhou Shengyu Import And Export Trading Co., Ltd.",No info,2.9/5.0 (73),https://www.alibaba.com/product-detail/Factory-Direct-Beachwear-Bikini-Swimwear-Brands_1601259606433.html
3,2025 nuevo Bikini personalizado con textura suave sutil cintura alta nadar ropa de playa corta,7.9,7.9,7.9,USD,"Fuxin Di Linte Garments Trade Co., Ltd.",No info,No rating,https://www.alibaba.com/product-detail/2025-New-Subtle-Soft-Textured-Custom_1601225102272.html
3,Nueva llegada Traje de baño de las mujeres Conjunto de dos piezas Trajes de baño Señora Bikini Set Sexy Ropa de playa,7.0,8.0,7.5,USD,"Dongguan Panther Sporting Goods Co., Ltd.",No info,4.7/5.0 (8),https://www.alibaba.com/product-detail/New-Arrival-Women-Swimwear-Two-Piece_1600390631011.html
3,"Traje de baño para mujer, conjunto de Bikini Sexy triangular de dos piezas, traje de baño de alta calidad OEM, traje de baño de encaje de Color de contraste personalizado para mujer",12.0,12.0,12.0,USD,"Guangdong JYJ Garment Co., Ltd.",1.258 vendidos,5.0/5.0 (10),https://www.alibaba.com/product-detail/Bathing-Suit-for-Women-Two-Piece_1600867065902.html
3,Venta al por mayor de la fábrica Traje de baño Bikini Bottom Mujeres Cintura alta Ropa de playa Cordón Ropa de baño,3.82,3.82,3.82,USD,"Shenzhen Beilei Technology Co., Ltd.",5 vendidos,5.0/5.0 (10),https://www.alibaba.com/product-detail/Factory-Wholesale-Swimwear-Bikini-Bottom-Women_1601213166090.html
3,Traje de baño atractivo de las mujeres del alto rendimiento de la venta caliente,7.23,7.23,7.23,USD,"Xinxiang Xiao Dong Clothing Co., Ltd.",No info,4.3/5.0 (18),https://www.alibaba.com/product-detail/Hot-Sale-High-Performance-Women-Sexy_1601384341092.html
3,"Conjunto de Bikini con Push-Up para mujer, bañador Sexy, ropa de playa, Bikini de dos piezas, traje de baño con Tanga",4.0,4.28,4.14,USD,"Uniker Sport Co., Ltd.",No info,4.7/5.0 (41),https://www.alibaba.com/product-detail/Women-s-Swimwear-Sexy-Bikini-Set_1600540980642.html
3,Nueva llegada de moda personalizada Logo Bikini Set Mujeres Sexy Trajes de baño Traje de baño Ropa de playa Bikini,3.8,3.8,3.8,USD,"Yiwu Qianjun Clothing Co., Ltd.",28 vistas,4.4/5.0 (170),https://www.alibaba.com/product-detail/New-Arrivals-Custom-Fashion-Logo-Bikini_1600851991573.html
3,Traje de baño de Venta caliente Ropa de playa Bikini sexy Traje de baño de mujer Verano Diseño mixto Traje de baño de mujer Entrega aleatoria,0.4,0.6,0.5,USD,Guangzhou Yufu Clothing Trading Firm (sole Proprietorship),No info,5.0/5.0 (6),https://www.alibaba.com/product-detail/Hot-Selling-Swimwear-Beach-Wear-Sexy_1601428258258.html
3,"Traje de baño personalizado de 2 piezas, traje de baño de verano, traje de baño deportivo de talla grande para mujer",6.2,6.2,6.2,USD,"Xiamen Zhongtaimei Clothing Co., Ltd.",4 vistas,4.9/5.0 (45),https://www.alibaba.com/product-detail/Custom-2-Piece-Swim-Suit-Summer_1600284277812.html
4,Trajes de baño personalizados OEM de marca privada Fabricante de Bikini Trajes de baño de alta calidad para mujeres 2025,10.8,10.8,10.8,USD,"Guangdong Mly Garment Co., Ltd.",10.486 vendidos,4.9/5.0 (199),https://www.alibaba.com/product-detail/Private-Label-OEM-Custom-Swimwear-Bikini_60721115591.html
4,MLY marca privada brillante Bikini personalizado Sexy volante traje de baño de alta calidad al por mayor traje de baño personalizado,4.99,12.0,8.5,USD,"Guangdong Mly Garment Co., Ltd.",4.205 vendidos,4.9/5.0 (128),https://www.alibaba.com/product-detail/MLY-Private-Label-Shiny-Bikini-Custom_1600334737758.html
4,Bañador de dos piezas metálico de alta calidad personalizado recién llegado con pierna alta para cubrir la playa traje de baño para bañarse,5.4,6.4,5.9,USD,RUIMART STORES LTD,No info,No rating,https://www.alibaba.com/product-detail/New-Arrival-Custom-High-Quality-Metallic_1601159693500.html
4,Dear-Lover New Arrivals Color Block Cordón Lateral Cuello en V Cintura alta Traje de baño Bikini Set,6.48,7.62,7.05,USD,"Fujian New Shiying E-Commerce Co., Ltd.",711 vendidos,4.9/5.0 (109),https://www.alibaba.com/product-detail/Dear-Lover-New-Arrivals-Color-Block_1601367098610.html
4,"Bikini Bandeau de dos piezas para mujer, traje de baño Mini, Micro ahuecado, de una pieza",5.36,7.25,6.3,USD,SW GROUP OF COMPANIES,No info,No rating,https://www.alibaba.com/product-detail/Women-Swimwear-Bikini-Two-Piece-Bikini_11000005966900.html
4,"Trajes de baño con estampado de leopardo sexy, trajes de baño personalizados para mujer, conjuntos de Bikini",3.99,12.0,8.0,USD,"Dongguan Joy Sportswear Co., Ltd.",844 vendidos,4.9/5.0 (100),https://www.alibaba.com/product-detail/Sexy-Leopard-Print-Swimwear-Manufacturer-Customized_1601366546640.html
4,Moda de moda Ropa de playa Trajes de baño de carreras de secado rápido Cuello alto Cremallera Tanga Traje de baño Mujeres Traje de baño de una pieza a los mejores precios,12.0,12.0,12.0,USD,Private Label Clothing Company,10 vendidos,No rating,https://www.alibaba.com/product-detail/Trending-Fashion-Beachwear-Quick-Dry-Racing_11000021544831.html
4,"Bañador de cintura alta, traje de baño rosa con cuello Halter, talla grande",5.0,15.0,10.0,USD,"Guangzhou Chiyi Industrial Co., Ltd.",197 vistas,4.9/5.0 (9),https://www.alibaba.com/product-detail/High-Waist-Swimsuit-Swimsuit-Pink-Halter_1600572510044.html
4,"Traje de baño de lujo para mujer, estilo de stock, Bikinis de lujo para mujer, trajes de baño para mujer, conjunto de Bikini para adultos, Bikinis de diseñador originales",3.3,6.9,5.1,USD,Yiwu Zhangqin E-Commerce Firm (individual Business),1.880 vendidos,4.6/5.0 (65),https://www.alibaba.com/product-detail/Women-Luxury-Swimwear-Stock-Style-Women_1601243417006.html
4,"Conjuntos de Bikini triangular de dos piezas con logotipo personalizado 2025, traje de baño de encaje, ropa de playa, tangas con estampado de colores en contraste, diseñador personalizado",5.88,9.88,7.88,USD,"Guangdong JYJ Garment Co., Ltd.",144 vendidos,5.0/5.0 (10),https://www.alibaba.com/product-detail/Custom-Logo-2025-Two-Piece-Triangle_1601323307962.html
4,"Bikini de fabricante personalizado con logotipo de metal, traje de baño de dos piezas, traje de baño Sexy, traje de baño para mujer 2024",4.33,12.0,8.16,USD,"Foshan JM Garment Co,.Ltd",2.215 vendidos,4.9/5.0 (31),https://www.alibaba.com/product-detail/Custom-Manufacturer-Bikini-With-Metal-Logo_1601075109291.html
4,"Traje de baño de dos piezas con estampado retro de alta calidad y logotipo personalizado, conjunto de bikini con borlas para niñas, ropa de playa deportiva",7.56,7.56,7.56,USD,"Yiwu Wenshuo Import And Export Co., Ltd.",79 vendidos,4.5/5.0 (128),https://www.alibaba.com/product-detail/Custom-Logo-High-Quality-Retro-Printing_1600481404825.html
4,Novedades Young Hot Girl Sexy Impresión digital Ladies Beachwear Traje de baño y ropa de playa,6.99,6.99,6.99,USD,INFLOW SPORTS,No info,4.9/5.0 (13),https://www.alibaba.com/product-detail/New-Arrivals-Young-Hot-Girl-Sexy_10000000096811.html
4,"Bikini liso de una pieza con espalda descubierta para mujer, traje de baño Sexy de talla grande, ropa de playa",7.11,7.11,7.11,USD,"Yiwu Ouze Clothing Co., Ltd.",20 vendidos,4.3/5.0 (596),https://www.alibaba.com/product-detail/Sexy-Women-s-Swimwear-Cheap-Solid_1600417321128.html
4,Traje de baño personalizado Bikini con cordón Conjunto de 2 piezas Ropa de playa Fitness Color sólido Traje de baño de mujer Tanga Traje de baño para mujer,3.47,3.47,3.47,USD,"Dongguan City Starwin Lingerie Co., Ltd.",358 vistas,4.7/5.0 (25),https://www.alibaba.com/product-detail/Custom-Bathing-Suit-Drawstring-String-Bikini_1600718489616.html
4,B012 niñas cristales traje de baño ropa Bling ropa de playa moda diamantes de imitación Bikinis cristal mono,11.52,11.52,11.52,USD,"Guangzhou Horae Industrial Co., Ltd.",340 vendidos,4.8/5.0 (64),https://www.alibaba.com/product-detail/B012-Girls-Crystals-Swimwear-Clothing-Bling_1600783705361.html
4,Hot Trending Color sólido Sujetador Sexy Beachwear Traje de baño Conjunto de bikini de dos piezas Traje de baño de mujer,5.76,5.76,5.76,USD,"Shenzhen Wojieer Technology Co., Ltd.",30 vendidos,4.6/5.0 (10),https://www.alibaba.com/product-detail/Hot-Trending-Solid-Color-Bra-Sexy_1601397101743.html
4,JSN Patchwork mujer ropa de playa Mono cruzado vendaje espalda deportes Fitness una pieza mujeres traje de baño,7.08,7.08,7.08,USD,"Shenzhen Jie Shi Ni Industrial Co., Ltd.",12 vendidos,4.8/5.0 (105),https://www.alibaba.com/product-detail/JSN-Patchwork-Female-Beachwear-Bodysuit-Cross_1601198673175.html
4,Traje de baño de mujer personalizado nueva llegada estampado Mujer traje de baño Oem estampado de cebra bikini torcido,10.0,15.0,12.5,USD,"Guangzhou Chiyi Industrial Co., Ltd.",No info,4.1/5.0 (3),https://www.alibaba.com/product-detail/Custom-Women-Swimsuit-New-Arrival-Print_1600608226340.html
4,"Bikini personalizado de dos piezas, traje de baño Sexy para mujer, bañador brasileño con Tanga, 2022",5.3,10.0,7.65,USD,Engrain Impex,No info,No rating,https://www.alibaba.com/product-detail/Custom-Bikini-Manufacturer-Two-Piece-Bathing_11000003069509.html
4,OEM personalizado 2025 nuevo Bikini de una pieza ropa de playa cremallera manga larga traje de baño mujeres Wrap deporte surf traje de baño,8.55,9.55,9.05,USD,"Guangzhou Le Yong Sports Goods Co., Ltd.",112 vendidos,4.9/5.0 (49),https://www.alibaba.com/product-detail/Oem-Custom-2025-New-One-Piece_1600929824619.html
