pagina,titulo,precio_min,precio_max,precio_promedio,moneda,proveedor,ventas,rating,link
1,Hot Internet Bikini rojo Sexy Traje de baño de dos piezas Mujer Hot Spring Vacation Photo Traje de baño Conjunto de dos piezas,1.9,1.9,1.9,USD,"Dongyang Kelaifu Clothing Co., Ltd.",10 vendidos,No rating,https://www.alibaba.com/product-detail/Hot-Internet-Red-Bikini-Sexy-Two_1601400551978.html?s=p
1,Leeyi OEM impermeable traje de baño Menstrual Bikini absorbente 4 capas a prueba de fugas bragas menstruales para mujeres bragas de período sin costuras,3.4,3.4,3.4,USD,"Shantou Leeyi Garment Co., Ltd.",6.341 vendidos,5.0/5.0 (3),https://www.alibaba.com/product-detail/Leeyi-OEM-Waterproof-Swimwear-Menstrual-Bikini_1601374547029.html?s=p
1,Venta al por mayor de correa ajustable personalizada Micro Abierto Popular Sexy encantos lindos personalizados Tanga Bikini,1.9,1.9,1.9,USD,"Dongyang Kelaifu Clothing Co., Ltd.",No info,No rating,https://www.alibaba.com/product-detail/Wholesale-Custom-Adjustable-Strap-Micro-Open_1601401383043.html?s=p
1,"Trajes de baño con patrón de flores para niñas pequeñas, ropa de baño para niñas, ropa de playa, traje de baño de una pieza",4.2,4.96,4.58,USD,"Shijiazhuang Gonghao Textile Co., Ltd.",No info,4.5/5.0 (5),https://www.alibaba.com/product-detail/Little-Girls-Cute-Flower-Pattern-Swim_1600798083247.html?s=p
1,DIVE & SAIL UPF50 + Sublimación Anti-Medusa Mujer Hombre Traje de baño Surf Rash Guard Venta al por mayor Top,6.3,6.3,6.3,USD,"Dongguan Yihai Sport Products Co., Ltd.",No info,4.9/5.0 (58),https://www.alibaba.com/product-detail/DIVE-SAIL-UPF50-Sublimation-Anti-Jellyfish_1601430411914.html?s=p
1,2025 personalizado de alta calidad de lujo de las mujeres triángulo Bikini conjunto diseñador traje de baño geométrico Cordón de talla grande traje de baño gratis,8.8,13.4,11.1,USD,"Tangshan Night Nishang Trade Co., Ltd.",No info,No rating,https://www.alibaba.com/product-detail/2025-Custom-High-Quality-Luxury-Women_1601458799100.html?s=p
1,Precio bajo Traje de baño para mujer Venta mixta Verano Elegante Playa Moda Slim Sexy Mix Traje de baño Ropa Stocks,0.49,0.99,0.74,USD,"Fuzhou Ecoly Trading Co., Ltd.",1.806 vendidos,4.3/5.0 (203),https://www.alibaba.com/product-detail/Low-Price-Womens-Swimsuit-Mixed-Sale_1600747698444.html
1,2025 nuevo traje de baño de mujer de alta calidad de bajo costo el traje de baño de mujer de segunda mano más popular enviado al azar,0.1,0.99,0.55,USD,Fuzhou High-Tech Zone Yujian Clothing Firm (individual Business),3 vendidos,4.7/5.0 (120),https://www.alibaba.com/product-detail/2025-New-Low-cost-High-quality_1601383397629.html
1,Traje de baño Fabricante Bajo MOQ Logotipo personalizado Mini Bikini Camiseta Tres piezas Sexy Traje de baño de las mujeres Bikini Set,4.0,10.0,7.0,USD,"Guangdong Mly Garment Co., Ltd.",15 vendidos,4.9/5.0 (199),https://www.alibaba.com/product-detail/Swimwear-Manufacturer-Low-MOQ-Customized-Logo_60801027575.html
1,2025 personalizado etiqueta privada Bikini alta calidad Sexy chica natación traje de baño,5.0,7.9,6.45,USD,"Guangdong Mly Garment Co., Ltd.",25.833 vendidos,4.9/5.0 (128),https://www.alibaba.com/product-detail/2025-Custom-Private-Label-Bikini-High_1600171008467.html
1,"2025 conjuntos de Bikini para mujer, trajes de baño de dos piezas, conjunto de Bikini con tiras, traje de baño Sexy para mujer",2.99,7.99,5.49,USD,Shenzhen Longgang District Turing Technology Center (individual Business),No info,4.7/5.0 (861),https://www.alibaba.com/product-detail/2025-Bikini-Sets-for-Women-Swim_1601429926064.html
1,"Conjunto de bañadores de talla grande, trajes de baño personalizados, 2021",2.9,3.9,3.4,USD,"Xiamen Meiju Garment Co., Ltd.",No info,4.7/5.0 (18),https://www.alibaba.com/product-detail/2021-Plus-Size-Swimwear-Swimsuit-Sets_1600242896269.html
1,Fabricante de trajes de baño Conjuntos de Bikini personalizados Tops de manga corta para mujer Traje de baño OEM Pantalones cortos de baño Bikini caliente,5.0,9.0,7.0,USD,"Dongguan Joy Sportswear Co., Ltd.",7.514 vendidos,4.9/5.0 (100),https://www.alibaba.com/product-detail/Swimwear-Manufacturer-Customized-Bikini-Sets-Women_1601212038185.html
1,Big Bale Ropa She Al Por Mayor Ropa de mujer Ropa mixta Vestido nuevo Bikinis a granel Traje de baño Ropa,1.77,1.77,1.77,USD,"Quanzhou Fengze Yangrui Technology Co., Ltd.",3.148 vendidos,3.8/5.0 (49),https://www.alibaba.com/product-detail/Big-Bale-Ropa-She-Al-Por_1601266586419.html
1,"Bikini liso de una pieza con espalda descubierta para mujer, traje de baño Sexy de talla grande, ropa de playa",7.11,7.11,7.11,USD,"Yiwu Ouze Clothing Co., Ltd.",20 vendidos,4.3/5.0 (596),https://www.alibaba.com/product-detail/Sexy-Women-s-Swimwear-Cheap-Solid_1600417321128.html
1,ANNA Nuevo traje de baño sexy Bikini Ropa de playa Stock Ropa,0.29,0.99,0.64,USD,"Fuzhou Jin 'an District Xiangqian Trading Co., Ltd.",No info,3.4/5.0 (96),https://www.alibaba.com/product-detail/ANNA-New-Sexy-Swimsuit-Bikini-Beach_1600993709214.html
1,Bikini traje de baño mujer nada una pieza traje de baño Bikinis 2025 verano Sexy mono de cintura alta Rosa ropa de playa,4.8,4.8,4.8,USD,Yiwu Orange Sui Import And Export Company Limited,15 vendidos,4.9/5.0 (20),https://www.alibaba.com/product-detail/Bikini-Bathing-Suit-Women-Swims-One_1600835923555.html
1,"2024 HLY, superventas, trajes de baño para mujer, ropa en Stock, mezcla de Bikinis sexys para chicas jóvenes, venta al por mayor, ropa de baño a granel",1.69,2.09,1.89,USD,"Shenzhen Hengliyuan Technology Co., Ltd.",750 vendidos,3.8/5.0 (247),https://www.alibaba.com/product-detail/2024-HLY-Hot-Selling-Swimsuits-for_1601248269450.html
1,Traje de baño sólido de tres piezas 2024 nuevo conjunto de Bikini de moda de malla Sexy traje de baño dividido Bikinis y ropa de playa,3.6,3.9,3.75,USD,"Shaoxing Zhe Zhu Import And Export Co., Ltd.",14 vendidos,4.1/5.0 (1494),https://www.alibaba.com/product-detail/Solid-Three-piece-Swimsuit-2024-New_1601023658030.html
1,"Conjunto de Bikini estampado de cintura alta de alta calidad, superventas de 2024, conjunto de traje de baño de dos piezas, traje de baño de Bikini para mujer, enviado al azar",0.1,0.99,0.55,USD,"Fuzhou Baodeyou Trading Co., Ltd.",59 vendidos,4.3/5.0 (231),https://www.alibaba.com/product-detail/2024-Hot-Selling-High-quality-High_1601265894112.html
1,"PASUXI-Bikini dorado brillante para chica joven, traje de baño liso a la moda, ropa de playa elegante",4.4,4.88,4.64,USD,"Hangzhou Huanwei Trading Co., Ltd.",7 vendidos,4.3/5.0 (506),https://www.alibaba.com/product-detail/PASUXI-Hot-Selling-Gold-Bling-Special_62333247173.html
1,2023 nuevo listado traje de baño Bikini conjunto al por mayor personalizado Color sólido traje de baño Push up ropa de playa trajes de baño para mujeres,4.5,4.5,4.5,USD,"Zhejiang Pretty Clothing Co., Ltd.",27 vendidos,4.4/5.0 (179),https://www.alibaba.com/product-detail/2023-New-Listing-Swimwear-Bikini-Set_1601286382211.html
1,2024 venta al por mayor nuevo traje de baño Sexy para damas maduras para playa piscina moda mujer Split sólido Skimpy Bikini ropa interior sujetador traje de baño,5.11,5.11,5.11,USD,"Xiamen Ahong Youxuan Trading Co., Ltd.",4 vendidos,4.5/5.0 (230),https://www.alibaba.com/product-detail/2024-Wholesale-New-Sexy-Ladies-Mature_1600530606615.html
1,Diseñe su propio traje de baño Oem Knot Bikini acanalado traje de baño,5.0,9.9,7.45,USD,"Guangzhou Qingyang Clothing Co., Ltd.",734 vendidos,5.0/5.0 (4),https://www.alibaba.com/product-detail/Design-Your-Own-Swimwear-Oem-Knot_62007020276.html
1,2023 nuevo diseño traje de baño personalizado Tanga dos piezas moda Bikini conjunto Oem Color sólido Fitness traje de baño ropa de playa para mujeres,4.85,4.85,4.85,USD,"Quanzhou Xinshisheng Clothing Co., Ltd.",577 vendidos,4.3/5.0 (66),https://www.alibaba.com/product-detail/2023-New-Design-Swimsuit-Custom-Thong_1601208560759.html
1,Popular al por mayor Irregular impreso cubierta 3 piezas traje de baño conjunto nuevo diseño de alta calidad playa Bikini conjunto,7.81,7.81,7.81,USD,"Yiwu Wenshuo Import And Export Co., Ltd.",81 vendidos,4.5/5.0 (128),https://www.alibaba.com/product-detail/Popular-Wholesale-Irregular-Printed-Cover-3_1601272101798.html
1,"Traje de baño de una pieza blanco sexy para mujer, traje de baño recortado, Push up, Monokini, ropa de playa, trajes de baño, traje de baño para mujer",8.5,8.5,8.5,USD,"Shangrao Ouling Clothing Co., Ltd.",9 vendidos,4.4/5.0 (40),https://www.alibaba.com/product-detail/Sexy-White-One-Piece-Swimsuit-Women_1600175147985.html
1,Venta caliente Amber Heard Bikini Conjunto de 2 piezas Sujetador deportivo Traje de baño de talla grande Mujeres Sexy Traje de baño Hebilla Traje de baño barato,4.78,4.78,4.78,USD,"Shanghai Boxia Industrial Co., Ltd.",20 vendidos,4.5/5.0 (56),https://www.alibaba.com/product-detail/Hot-Selling-Amber-Heard-Bikini-2_1600823720645.html
1,"Traje de baño recortado para mujer, traje de baño de malla Sexy sólido, ropa de playa, traje de baño de 3 piezas para mujer, conjunto de Bikini con cubierta",6.2,6.2,6.2,USD,"Xiamen Caisi Trading Co., Ltd.",86 vendidos,4.0/5.0 (192),https://www.alibaba.com/product-detail/Cut-Out-Swimwear-Swimsuit-Women-Soild_1600467764523.html
1,Traje de baño personalizado con logotipo 2021 Venta caliente al por mayor Bikini Body Ropa de playa Traje de baño personalizado Traje de baño de una pieza,7.63,7.63,7.63,USD,"Guangzhou Fenqi Leather Co., Ltd.",12 vendidos,4.7/5.0 (974),https://www.alibaba.com/product-detail/Custom-Swimwear-With-logo-2021-Hot_1600223412622.html
1,JSN 2024 nuevo traje de baño mujeres sólido tiras Bandeau ropa de playa traje de baño brasileño Sexy cintura baja Bikini conjuntos,7.51,7.51,7.51,USD,"Shenzhen Jie Shi Ni Industrial Co., Ltd.",176 vendidos,4.8/5.0 (105),https://www.alibaba.com/product-detail/JSN-2024-New-Swimsuit-Swimwear-Women_1601236593281.html
1,2024 Traje de baño de una pieza de secado rápido para mujer Amazon Nuevo traje de baño deportivo europeo y americano para aguas termales,5.37,5.71,5.54,USD,"Qianshan Zhonghe Electronic Commerce Co., Ltd.",No info,4.6/5.0 (12),https://www.alibaba.com/product-detail/2024-Women-s-Quick-Dry-One_1601377231334.html
1,"Trajes de baño MLY personalizados de 2 piezas para mujer, trajes de baño de alta calidad para mujer",5.0,15.0,10.0,USD,"Guangdong Mly Garment Co., Ltd.",1.027 vendidos,5.0/5.0 (54),https://www.alibaba.com/product-detail/MLY-Custom-2-Piece-Bathing-Suits_1601298763235.html
1,Tres piezas Sexy verano playa moda Push-up sujetador Bikini conjunto ropa de playa trajes de baño para mujer,4.23,4.23,4.23,USD,"Shenzhen Wojieer Technology Co., Ltd.",43 vendidos,4.6/5.0 (10),https://www.alibaba.com/product-detail/Three-Piece-Sexy-Summer-Beach-Fashion_1601396879813.html
1,2024 moda Sexy mujer triángulo natación Top y String Bikini inferior trajes de baño traje de baño,8.9,8.9,8.9,USD,Guang Xi Ning Bo Trading Comany Ltd.,78 vendidos,4.7/5.0 (103),https://www.alibaba.com/product-detail/2024-Fashion-Sexy-Women-Triangle-Swimming_1601213217173.html
1,"Traje de baño de secado rápido, nuevo traje de baño para mujer, Bikini de lujo, ropa de playa, conjunto Sexy de dos piezas, traje de baño de dos piezas, Bikini con lazo de Color sólido para bañarse",6.21,6.21,6.21,USD,"Huludao Sifu Garment Co., Ltd.",No info,5.0/5.0 (2),https://www.alibaba.com/product-detail/quick-dry-swimsuit-New-Women-s_1601399128787.html
1,Trajes de baño Mujer Bikini Ropa Venta al por mayor Descuento Pacas Ropa Stock Ventas Surtido a granel Bikini Traje de baño Conjunto,1.59,1.59,1.59,USD,"Guangzhou Tianyu Trading Co., Ltd.",400 vendidos,4.1/5.0 (96),https://www.alibaba.com/product-detail/Swimsuits-Women-Bikini-Clothes-Wholesale-Discount_1601118102039.html
1,"WoYing-Conjunto de Bikini liso para mujer, bañador Sexy con Tanga y lazo lateral, traje de baño de estilo vendaje",1.85,1.85,1.85,USD,"Yiwu Woying Electronic Commerce Co., Ltd.",429 vendidos,4.3/5.0 (20),https://www.alibaba.com/product-detail/WoYing-Sexy-Solid-Mirco-Bikini-Sets_1600507318320.html
1,TW Starfish Sexy Bikini Set Mujeres Traje de baño de dos piezas Trajes de baño femeninos Traje de baño Ropa de playa,5.89,5.89,5.89,USD,"Shenzhen Tengwei Clothing Co., Ltd.",48 vendidos,4.6/5.0 (104),https://www.alibaba.com/product-detail/TW-Starfish-Sexy-Bikini-Set-Women_1601351949987.html
1,Mujeres Body Trajes de baño Venta al por mayor 3 piezas Bikini Traje de baño Ropa de playa Cubrir Sarong Tie up Set Swimsuitbikini Traje de baño,4.8,4.8,4.8,USD,"Xuzhou Yangguang Beauty Co., Ltd.",133 vendidos,4.8/5.0 (14),https://www.alibaba.com/product-detail/Women-Bodysuit-Bathing-Suits-Wholesale-3_1601257550246.html
1,Venta al por mayor diseñador 2024 verano Mujer moda Bikini traje de baño de dos piezas traje de baño de las mujeres conjunto ropa de playa envío al azar,0.1,0.99,0.55,USD,"Fuzhou Youlead Promotion Business Co., Ltd.",4 vendidos,4.3/5.0 (220),https://www.alibaba.com/product-detail/Wholesale-Designer-2024-Summer-Women-s_1601214879310.html
1,"2025 verano señora traje de baño ropa de playa Sexy fruta geométrica moda estilo traje de baño, ropa de baño Sexy de cuerpo completo",0.88,1.58,1.23,USD,"Guangzhou Ershou Clothing Technology Co., Ltd.",1.100 vendidos,4.9/5.0 (44),https://www.alibaba.com/product-detail/2025-Summer-Lady-Swimwear-Beachwear-Sexy_1601389734619.html
1,"Traje de baño para niñas, peleles bonitos, moda de baño",7.4,7.6,7.5,USD,"Zhuhai Enge Clothing Co., Ltd.",4 vendidos,4.8/5.0 (247),https://www.alibaba.com/product-detail/Wholesale-Girls-Swimwear-Children-s-Cute_1600738564465.html
1,Sexy Bikini Set New Top Beachwear Traje de baño brasileño Traje de baño Mujeres Trajes de dos piezas,4.89,4.89,4.89,USD,"Shenzhen Siyuete Technology Co., Ltd.",73 vendidos,4.8/5.0 (65),https://www.alibaba.com/product-detail/Sexy-Bikini-Set-New-Top-Beachwear_1601215380830.html
1,2 unids/set traje de baño seductor tipo Split Color sólido sujetador sin cables conjunto de Tanga Día de San Valentín Bikini estilo traje de baño,1.02,1.02,1.02,USD,"Henan Jingyu Network Technology Co., Ltd.",No info,4.6/5.0 (167),https://www.alibaba.com/product-detail/2pcs-set-Swimsuit-Seductive-Split-Type_1601157755578.html
1,Hot Sexy Bikini Mujeres Ropa de playa Trajes de baño Moda Traje de baño de dos piezas Traje de baño Sexy Ladies Bikini Sets,5.5,5.5,5.5,USD,"Xiamen Mega Garment Co., Ltd.",1 vendido,4.8/5.0 (59),https://www.alibaba.com/product-detail/Hot-Sexy-Bikini-Women-Beachwear-Bathing_1601206174573.html
1,Trajes de baño de mujer de alta calidad fabricante de bikini con logotipo personalizado éxito de ventas,9.66,11.66,10.66,USD,"Dongguan Betteractive Fashion Co., Ltd.",No info,4.9/5.0 (99),https://www.alibaba.com/product-detail/Hot-Sale-Custom-logo-Swimwear-Bikini_1600251003298.html
2,PASUXI 2024 traje de baño ropa de playa Mujer alta calidad Bikini trajes de baño personalizado cadena Bikinis Sexy sólido 2 piezas conjunto,4.56,4.56,4.56,USD,"Henan Huanwei E-Business Co., Ltd.",4 vendidos,3.6/5.0 (13),https://www.alibaba.com/product-detail/PASUXI-2024-Swimwear-Beachwear-Women-High_1600880159903.html
2,"Bikini de dos piezas al por mayor de fábrica, conjuntos de trajes de baño brasileños con flores, trajes de baño para mujer",5.99,5.99,5.99,USD,"Guangzhou Balry International Trade Co., Ltd.",721 vendidos,4.4/5.0 (147),https://www.alibaba.com/product-detail/Factory-Wholesale-Two-Piece-Bikini-Swimwear_1601202647623.html
2,"WoYing-Conjunto de Bikini liso para mujer, bañador Sexy con Tanga y lazo lateral, traje de baño de estilo vendaje",1.85,1.85,1.85,USD,"Yiwu Woying Electronic Commerce Co., Ltd.",429 vendidos,4.3/5.0 (20),https://www.alibaba.com/product-detail/WoYing-Sexy-Solid-Mirco-Bikini-Sets_1600507318320.html
2,Mujeres Body Trajes de baño Venta al por mayor 3 piezas Bikini Traje de baño Ropa de playa Cubrir Sarong Tie up Set Swimsuitbikini Traje de baño,4.8,4.8,4.8,USD,"Xuzhou Yangguang Beauty Co., Ltd.",133 vendidos,4.8/5.0 (14),https://www.alibaba.com/product-detail/Women-Bodysuit-Bathing-Suits-Wholesale-3_1601257550246.html
2,"2025 verano señora traje de baño ropa de playa Sexy fruta geométrica moda estilo traje de baño, ropa de baño Sexy de cuerpo completo",0.88,1.58,1.23,USD,"Guangzhou Ershou Clothing Technology Co., Ltd.",1.100 vendidos,4.9/5.0 (44),https://www.alibaba.com/product-detail/2025-Summer-Lady-Swimwear-Beachwear-Sexy_1601389734619.html
2,"Traje de baño para niñas, peleles bonitos, moda de baño",7.4,7.6,7.5,USD,"Zhuhai Enge Clothing Co., Ltd.",4 vendidos,4.8/5.0 (247),https://www.alibaba.com/product-detail/Wholesale-Girls-Swimwear-Children-s-Cute_1600738564465.html
2,"Ummer-Juego de tapones para las orejas de los auriculares, juego de audífonos de 2023 cm, de diferentes colores",6.0,6.0,6.0,USD,"Shenzhen Ou Fashion Imp. & Exp. Co., Ltd.",No info,4.3/5.0 (2296),https://www.alibaba.com/product-detail/Women-Summer-2023-Popular-Sexy-Bikinis_1600819441284.html
2,Sexy Bikini Set New Top Beachwear Traje de baño brasileño Traje de baño Mujeres Trajes de dos piezas,4.89,4.89,4.89,USD,"Shenzhen Siyuete Technology Co., Ltd.",73 vendidos,4.8/5.0 (65),https://www.alibaba.com/product-detail/Sexy-Bikini-Set-New-Top-Beachwear_1601215380830.html
2,2 unids/set traje de baño seductor tipo Split Color sólido sujetador sin cables conjunto de Tanga Día de San Valentín Bikini estilo traje de baño,1.02,1.02,1.02,USD,"Henan Jingyu Network Technology Co., Ltd.",No info,4.6/5.0 (167),https://www.alibaba.com/product-detail/2pcs-set-Swimsuit-Seductive-Split-Type_1601157755578.html
2,Hot Sexy Bikini Mujeres Ropa de playa Trajes de baño Moda Traje de baño de dos piezas Traje de baño Sexy Ladies Bikini Sets,5.5,5.5,5.5,USD,"Xiamen Mega Garment Co., Ltd.",1 vendido,4.8/5.0 (59),https://www.alibaba.com/product-detail/Hot-Sexy-Bikini-Women-Beachwear-Bathing_1601206174573.html
2,Liu Ming Venta caliente personalizado al por mayor OEM barato mujeres Sexy más colores sólidos traje de baño Bikini,2.34,2.34,2.34,USD,"Jinjiang Liuming Trading Co., Ltd.",112 vendidos,4.1/5.0 (177),https://www.alibaba.com/product-detail/Liu-Ming-Hot-Selling-Custom-Wholesale_62363757941.html
2,Traje de baño de fabricante Ropa de playa Tallas grandes String Bikinis Set Sexy Logotipo personalizado Impresión Diseñador Color sólido Traje de baño de una pieza,4.69,4.69,4.69,USD,"Quanzhou Senyun Apparel Co., Ltd.",109 vendidos,4.4/5.0 (273),https://www.alibaba.com/product-detail/Manufacturer-Swimwear-Beachwear-Plus-Size-String_1601015822688.html
2,"Bikini plisado Bandeau de Color liso para mujer, traje de baño de tres piezas, accesorios de playa, 2021",6.7,6.7,6.7,USD,"Guangzhou Xuanlang Garments Co., Ltd.",3 vistas,4.2/5.0 (8),https://www.alibaba.com/product-detail/Solid-Color-Sexy-Bikini-2021-Pleated_1600657513252.html
2,Trajes de baño de mujer de alta calidad fabricante de bikini con logotipo personalizado éxito de ventas,9.66,11.66,10.66,USD,"Dongguan Betteractive Fashion Co., Ltd.",No info,4.9/5.0 (99),https://www.alibaba.com/product-detail/Hot-Sale-Custom-logo-Swimwear-Bikini_1600251003298.html
2,Venta caliente mujeres Sexy traje de baño femenino traje de baño mujeres Bikini conjunto bañista natación ropa de playa para traje de baño,1.84,1.84,1.84,USD,"Guangzhou Beicapeni Trade Co., Ltd.",9 vendidos,5.0/5.0 (1),https://www.alibaba.com/product-detail/Hot-Selling-Women-Sexy-Swimsuit-Female_1601430537447.html
2,"Trajes de baño de dos piezas impresos reversibles personalizados, conjunto de Bikini, ropa de baño para bebés, trajes de baño para niñas y niños",6.99,6.99,6.99,USD,"Yiwu Kerui Clothing Co., Ltd.",40 vistas,4.7/5.0 (179),https://www.alibaba.com/product-detail/Customize-Reversible-Printed-Summer-Two-Pieces_1601045085519.html
2,"Venta al por mayor de ropa de baño personalizada para niñas, conjunto de Bikini para mujeres maduras, traje de baño Sexy, Bikini abierto con cordón, traje de baño, servicio OEM",15.0,15.0,15.0,USD,"Shenzhen Ananda Trading Co., Ltd.",3 vendidos,5.0/5.0 (3),https://www.alibaba.com/product-detail/Wholesales-Custom-Girls-Swim-Clothing-Bikini_1601362607109.html
2,STOCK 5 colores V cuello diseñador dos piezas traje de baño Sexy mujer una pieza diseño traje de baño con playa Sarong,12.5,12.5,12.5,USD,"Guangzhou Fengxin Trade Co., Ltd.",187 vendidos,4.7/5.0 (65),https://www.alibaba.com/product-detail/STOCK-5Colors-V-Neck-Designer-Two_1600430266360.html
2,"Traje de baño de una pieza para mujer, de realce V con cuello en traje de baño, conjuntos de Bikinis con cordón Halter, ropa de playa, Monokinis, traje de baño de cintura alta",6.3,6.3,6.3,USD,"Xiamen Customing Garment Co.,ltd",6 vendidos,4.7/5.0 (29),https://www.alibaba.com/product-detail/Women-One-Piece-Swimsuit-V-Neck_1601108175011.html
2,RTS Mujeres Bikini Tallas grandes Traje de baño Biquini Bronceado Halter String Tanga Bikinis,1.25,1.25,1.25,USD,Maanshan City A Little Horse Network Technology Limited Liability Company,15 vendidos,4.6/5.0 (46),https://www.alibaba.com/product-detail/RTS-Women-Bikini-Plus-Size-Swimwear_1601320973131.html
2,Ropa de playa trajes de baño Biquini verano Brasil sólido un hombro Tanga traje de baño mujer traje de baño 2024New Sexy cintura baja Bikini conjunto,7.3,7.3,7.3,USD,Yiwu Moxian Garment Factory,500 vendidos,4.4/5.0 (26),https://www.alibaba.com/product-detail/Beachwear-Bathing-Suits-Biquini-Summer-Brazil_1601053130676.html
2,2024 nuevo listado traje de baño Bikini conjunto al por mayor personalizado Color sólido traje de baño Push up ropa de playa trajes de baño para mujeres,6.67,6.67,6.67,USD,"Shenyang Crazybuy Import And Export Co., Ltd.",11 vendidos,4.6/5.0 (152),https://www.alibaba.com/product-detail/2024-New-Listing-Swimwear-Bikini-Set_1601236682262.html
2,"Traje de baño profesional OEM, ropa de playa de diseñador fabricante bajo MOQ hecho traje de baño conjunto con logotipo de diseño personalizado Bikini de mujer 2023",6.0,13.0,9.5,USD,"Shenzhen Becarin Apparel Co., Ltd.",13.939 vendidos,4.9/5.0 (23),https://www.alibaba.com/product-detail/OEM-Professional-Swimwear-Beachwear-Manufacturer-Designer_1600722148522.html
2,Venta al por mayor nuevo Sexy brasileño sólido Mini Micro dos piezas Bikini triángulo Halter traje de baño mujeres lazo lateral corte alto Tanga traje de baño,4.77,4.77,4.77,USD,"Shenglong Swimming (huludao) Garment Trading Co., Ltd.",105 vendidos,4.9/5.0 (5),https://www.alibaba.com/product-detail/Wholesale-New-Sexy-Brazilian-Solid-Mini_1600976528806.html
2,Bikini Lurex sólido traje de baño 2025 mujeres traje de baño Push up Bikini conjunto brasileño traje de baño verano playa desgaste traje de baño XL,5.54,5.54,5.54,USD,"Shenzhen Yannisfashion Commerce Co., Ltd.",30 vendidos,4.0/5.0 (538),https://www.alibaba.com/product-detail/Bikini-Lurex-Solid-Swimsuit-2025-Women_1600268709904.html
2,"Conjunto de bikini de baño de secado rápido UPF 50 + para mujer de diseño personalizado OEM 2024, precio al por mayor de alta calidad, estampado de rayas solares de talla grande",3.95,4.95,4.45,USD,ALITZA INDUSTRIES,No info,5.0/5.0 (4),https://www.alibaba.com/product-detail/OEM-2024-Custom-Design-Women-s_10000016084744.html
2,Shain Venta caliente traje de baño ropa de playa Sexy Bikini traje de baño de mujer verano diseño mixto traje de baño de mujer entrega al azar,0.49,0.99,0.74,USD,"Fuzhou Shuiningxin Trading Co., Ltd.",12 vendidos,5.0/5.0 (13),https://www.alibaba.com/product-detail/Shain-Hot-Selling-Swimwear-Beach-Wear_1601390812196.html
2,Personalizado al por mayor de una pieza Sexy traje de baño para las mujeres Ropa de playa Traje de baño femenino Almohadillas extraíbles Traje de baño ODM,6.9,6.9,6.9,USD,"Shenzhen Bu Qing Yun Garment Co., Ltd.",2 vendidos,4.4/5.0 (47),https://www.alibaba.com/product-detail/Custom-Wholesale-One-Piece-Sexy-Swimwear_1601374915945.html
2,Fábrica personalizada OEM nueva moda más tamaño traje de baño ropa de playa traje de baño de una pieza de las mujeres traje de baño Bikini,2.29,2.29,2.29,USD,"Shenzhen Spark Industry Co., Ltd.",No info,4.7/5.0 (35),https://www.alibaba.com/product-detail/Factory-Custom-OEM-New-Fashion-Plus_1601055863685.html
2,Conjunto de bikini bikinis mujer trajes de bano para mujeres maduras mujeres sexy abierto bikini sexy chicas xxx china traje de baño ropa de playa,3.5,5.0,4.25,USD,HONG KONG GANGCHEN INTERNATIONAL TRADE LIMITED,27 vistas,4.9/5.0 (37),https://www.alibaba.com/product-detail/Bikini-Set-Bikinis-Mujer-Trajes-De_1601225691220.html
2,"Traje de baño de verano para niños, traje de baño de una pieza de manga corta, ropa de playa para niñas, traje de baño encantador para niños",3.05,3.05,3.05,USD,"Guangzhou Wilda Sporting Goods Co., Ltd.",1 vendido,4.7/5.0 (29),https://www.alibaba.com/product-detail/Kids-Summer-Swimsuit-Short-Sleeves-One_1601052825982.html
2,Venta al por mayor Bikini 3 piezas Set Mujeres Traje de baño Bikini Cubrir Trajes de baño Ropa de playa Mujeres Traje de baño,5.22,6.17,5.7,USD,"Pingtan Comprehensive Experimental Zone Nome Trading Co., Ltd.",15 vendidos,5.0/5.0 (1),https://www.alibaba.com/product-detail/Wholesale-Bikini-3-Piece-Set-Women_1601387230578.html
2,Traje de baño de una pieza para mujer Traje de baño con barriga Vestido retro Sexy Solo quiero remojar el cuello Traje de baño de aguas termales,3.64,3.64,3.64,USD,"Yiwu Qilang Sporting Goods Co., Ltd.",4 vendidos,5.0/5.0 (4),https://www.alibaba.com/product-detail/Women-s-One-piece-Swimsuit-Belly_1601078592225.html
2,Moda Bikini Estilos Personalización logo Traje de baño Ropa de playa 2023 Mujer de lujo Trajes de baño para niñas,8.0,15.0,11.5,USD,"Guangzhou Chiyi Industrial Co., Ltd.",741 vistas,4.9/5.0 (9),https://www.alibaba.com/product-detail/Fashion-Bikini-Styles-Customization-logo-Swimwear_1600778120934.html
