pagina,titulo,precio_min,precio_max,precio_promedio,moneda,proveedor,ventas,rating,link
4,"Traje de baño con cordón y logotipo personalizado, conjunto de Bikini Tanga, conjunto de 2 piezas, traje de baño para mujer, conjunto de Bikini con Tanga",4.25,7.5,5.88,USD,BOXING TREND,No info,No rating,https://www.alibaba.com/product-detail/Custom-logo-Drawstring-String-Bathing-Suit_10000018888472.html
4,Proveedores de fábrica Ropa de playa Trajes de baño Traje de baño sexy Diseño Traje de baño Halter Bikini Set Logotipo personalizado Traje de baño para mujer,5.65,8.95,7.3,USD,"Guangzhou Ifree Garment Co., Ltd.",2.994 vendidos,4.8/5.0 (7),https://www.alibaba.com/product-detail/Factory-Suppliers-Beachwear-Swimming-Suits-Sexy_1600993893294.html
4,Traje de baño de cintura alta de fábrica personalizado Control de barriga Crop Top con aros Push up trajes de baño de cintura alta de mujer 3 piezas traje de baño,6.5,6.5,6.5,USD,"Shenzhen Bu Qing Yun Garment Co., Ltd.",67 vendidos,4.4/5.0 (47),https://www.alibaba.com/product-detail/Custom-Factory-High-Waist-Swimsuit-Tummy_1601087613189.html
4,TW nuevo traje de baño femenino Bikini conjunto estampado tiras brasileño Tanga ropa de playa trajes de baño de cintura baja Sexy mujeres trajes de baño,7.51,7.51,7.51,USD,"Shenzhen Tengwei Clothing Co., Ltd.",245 vendidos,4.6/5.0 (104),https://www.alibaba.com/product-detail/TW-New-Female-Swimwear-Bikini-Set_1601168533613.html
4,NOVEDAD DE LLEGADAS STOCK 2 colores marca de lujo traje de baño largo Sexy mujer diseñador Fitness traje de baño,9.0,9.0,9.0,USD,"Guangzhou Fengxin Trade Co., Ltd.",44 vendidos,4.7/5.0 (65),https://www.alibaba.com/product-detail/NEW-ARRIVALS-STOCK-2Colors-Luxury-Brand_1600051501876.html
4,Venta al por mayor de ropa de baño Nuevas llegadas 2024 Fitness Traje de baño de una pieza para mujer Impresión digital Peso ligero Traje de baño logotipo personalizado,6.0,8.0,7.0,USD,CARE MASTER,No info,No rating,https://www.alibaba.com/product-detail/Wholesale-Swim-Wear-New-Arrivals-2024_11000015543021.html
4,STOCK 10 colores Corbatas Detalles Traje de baño básico Mujeres Cuentas Correa Final Bikini brasileño Conjunto,6.4,6.4,6.4,USD,"Guangzhou Feifeng Trade Co., Ltd.",28 vendidos,4.8/5.0 (38),https://www.alibaba.com/product-detail/STOCK-10Colors-Ties-Details-Basic-Swimwear_62148854949.html
4,Sexy Xxx de una pieza para chica Oem traje de baño mujeres chicas adolescentes traje de baño ropa de playa,5.71,5.71,5.71,USD,"Shanghai Touchhealthy Biotechnology Co., Ltd.",2 vendidos,4.8/5.0 (117),https://www.alibaba.com/product-detail/Sexy-Xxx-One-Piece-for-Girl_1601021634214.html
4,Venta al por mayor período de traje de baño Reutilizable Menstrual Ecológico Traje de baño para el período de las niñas 4 capas a prueba de fugas Trajes de baño de una pieza,6.39,7.19,6.79,USD,"Shantou Airtamay Clothing Co., Ltd.",29 vendidos,4.6/5.0 (26),https://www.alibaba.com/product-detail/Wholesale-Period-Swimwear-Reusable-Menstrual-Eco_1600522285975.html
4,2024 traje de baño conjunto de Bikini de cintura alta estampado personalizado niñas traje de baño ropa de playa Monokini Fitness trajes de baño para mujeres,4.36,4.36,4.36,USD,"Quanzhou Xinshisheng Clothing Co., Ltd.",685 vendidos,4.3/5.0 (66),https://www.alibaba.com/product-detail/2024-Swimwear-High-Waist-Bikini-Set_1601113829990.html
4,Traje de baño de verano de moda al por mayor precio venta caliente playa corta temporada vacaciones secado rápido personalizado Fitness traje de baño ropa de playa,8.14,8.14,8.14,USD,"Guangzhou Coton Sportswear Co., Ltd.",116 vendidos,5.0/5.0 (12),https://www.alibaba.com/product-detail/Swimwear-Summer-Fashionable-Wholesale-Price-Hot_1600271857361.html
4,B039 Pink Sparkling Bikini Sexy Beachwear Tanga Traje de baño de cintura alta con cordones Traje de baño de diamantes de imitación,7.56,12.8,10.18,USD,"Guangzhou Horae Industrial Co., Ltd.",1.358 vendidos,4.9/5.0 (30),https://www.alibaba.com/product-detail/B039-Pink-Sparkling-Bikini-Sexy-Beachwear_1601238085868.html
4,"2024, envío rápido, venta al por mayor, trajes de baño de diseñador inspirados en marcas famosas de lujo, ropa de playa, Bikini, trajes de baño de diseñador",8.0,8.0,8.0,USD,"Dalian Ysiman International Trade Co., Ltd.",22 vendidos,4.8/5.0 (80),https://www.alibaba.com/product-detail/2024-Fast-Shipping-Wholesale-Luxury-Famous_1600546995767.html
4,Bañador de una pieza para mujer,10.5,10.5,10.5,USD,Shantou Chaoyang District Gurao Yaqianli Clothing Firm,1 vendido,4.3/5.0 (16),https://www.alibaba.com/product-detail/Tan-Through-Swimwear-for-Women-and_1601096355118.html
4,"Nueva ropa de playa personalizada para mujer, conjunto de bikinis estampados, conjunto de traje de baño sexy de 3 piezas al por mayor",10.6,10.6,10.6,USD,"Xiamen JS Sport Leisure Trading Co., Ltd.",35 vendidos,4.6/5.0 (1),https://www.alibaba.com/product-detail/Custom-Women-New-Beachwear-Print-Bikinis_1601092336107.html
4,Traje de baño de cintura alta mangas largas Sexy Split Bikini mujeres 3 piezas ropa de playa 2024 traje de baño conjunto,7.5,7.5,7.5,USD,"Guangzhou Pzf Garment Co., Ltd.",72 vendidos,4.2/5.0 (56),https://www.alibaba.com/product-detail/Swimsuit-High-Waist-Long-Sleeves-Sexy_1600747913243.html
4,RUIYI Mujeres Halter Impreso Traje de baño Dos piezas Traje de baño personalizado Bikini Set,5.8,5.8,5.8,USD,"Jiaxing Ruiyi Import & Export Co., Ltd.",423 vendidos,4.6/5.0 (7),https://www.alibaba.com/product-detail/RUIYI-Women-Halter-Printed-Swimsuit-Two_1601044866661.html
4,"2024 nuevo traje de Bikini de lujo para mujer, traje de baño con Micro Tanga, servicio personalizado, gran oferta, Bikini de satén, traje de baño",7.13,10.69,8.91,USD,"Dongguan Joy Sportswear Co., Ltd.",1.588 vendidos,5.0/5.0 (5),https://www.alibaba.com/product-detail/2024-New-Luxury-Women-s-Bikini_1601204641413.html
4,OEM/ODM personalizado al por mayor precio traje de baño fabricante personalizado trajes de baño 2024 Bikini Bikinis traje de baño de dos piezas,7.99,12.99,10.49,USD,"Dongguan City Jingyu Apparel Co., Ltd.",111 vendidos,4.8/5.0 (15),https://www.alibaba.com/product-detail/OEM-ODM-Custom-Wholesale-Price-Swimwear_1600742155134.html
4,"Traje de baño transparente de talla grande y ropa de playa para mujer, conjunto Sexy de 2 piezas, traje de baño para cubrir, traje de baño, ropa de playa",8.5,8.5,8.5,USD,"Shenzhen Chiangqin Technology Co., Ltd.",17 vistas,4.6/5.0 (168),https://www.alibaba.com/product-detail/Plus-Size-See-Through-Swimwear-Beachwear_1600532230401.html
4,2024 lujo mujer Sexy Bikini traje de baño diseñador trajes de baño Micro Tanga Bikini,9.5,9.5,9.5,USD,"Shaoxing Jolon Gifts Co., Ltd.",47 vendidos,4.7/5.0 (7),https://www.alibaba.com/product-detail/2024-Luxury-Women-Sexy-Bikini-Swimwear_1600263270059.html
4,Venta de fábrica personalizado brasileño Sexy adolescente dos piezas Bikini ropa de playa Halter traje de baño mujeres Mini Micro Tanga Bikini traje de baño,2.82,2.82,2.82,USD,"Xingcheng Haidi Garment Co., Ltd.",87 vendidos,4.3/5.0 (8),https://www.alibaba.com/product-detail/Factory-Sales-Custom-Brazilian-Sexy-Teen_1600142189589.html
4,"Bikini dividido Sexy de verano de alta calidad para mujer, traje de baño con lazo, ropa de playa, venta al por mayor, Micro Bikini",4.28,6.42,5.35,USD,"Hangzhou Hongyue Technology Co., Ltd.",16 vendidos,5.0/5.0 (11),https://www.alibaba.com/product-detail/High-Quality-Summer-Sexy-Split-Bikini_1601239406424.html
4,Traje de baño de una pieza blanco sin espalda Traje de baño de vendaje para mujer,6.99,6.99,6.99,USD,"Hangzhou Fuyang Yifeng Garment Co., Ltd.",1 vista,4.8/5.0 (24),https://www.alibaba.com/product-detail/Backless-White-One-Piece-Swimwear-Women_1600574553639.html
4,"Microbikini con cuello Halter y Tanga, traje de baño de 2 piezas, Mini bañador con lazo lateral, traje de baño extremo de cuero PU, bañador de dos piezas",4.99,4.99,4.99,USD,"Jinan Jiajue Smart Technology Co., Ltd.",52 vendidos,4.4/5.0 (46),https://www.alibaba.com/product-detail/Halter-Neck-Micro-Thong-Bikini-2_1600531990957.html
4,"Ropa de baño para niños pequeños, traje de baño de manga corta para niñas, dos piezas, cremallera, borde de volantes, traje de baño, ropa de playa personalizada",6.7,6.7,6.7,USD,"Shanghai Hexuan Baby Products Co., Ltd.",40 vendidos,4.8/5.0 (76),https://www.alibaba.com/product-detail/Toddler-Swim-Clothes-Short-Sleeve-Girls_1601099459522.html
4,Liso Negro Beige Marrón Caliente Sexy Cuerda Abierta Doble Forro Reversible Mujeres Micro Mini Bikini Tallas grandes Traje de baño Ropa de playa,6.5,6.5,6.5,USD,"Guangzhou Xuanlang Garments Co., Ltd.",7 vendidos,4.2/5.0 (8),https://www.alibaba.com/product-detail/Plain-Black-Beige-Brown-Hot-Sexy_1600761938914.html
