titulo;precio;precio_original;descuento;ventas;link;pagina;plataforma;fecha_scraping;moneda;proveedor;proveedor_anios;proveedor_pais;proveedor_verificado;rating_score;rating_count;moq;moq_texto;envio_promesa;tasa_repeticion
Factory Classic Formal Business Dress Daily Men Slim Fit Long Suit Pants Trousers;22.5;;;0;https://www.alibaba.com/product-detail/Factory-Classic-Formal-Business-Dress-Daily_1600305626427.html;1;Alibaba;2025-12-11;$;;;;True;;;;;;
Customized Men's Casual Draped Dress Pants Double Pleated Autumn Design Pleated Wide-Leg Suit Trousers;14.69;;;0;https://www.alibaba.com/product-detail/Customized-Men-s-Casual-Draped-Dress_1601635876250.html;1;Alibaba;2025-12-11;$;;;;False;;;;;;
Men Business Suit Pants Formal Office Gentleman Suit Long Trousers Stretch Slim Straight Solid Color Casual Pants;8.0;;;0;https://www.alibaba.com/product-detail/Men-Business-Suit-Pants-Formal-Office_1600764711473.html;1;Alibaba;2025-12-11;$;;;;True;;;;;;
New Arrival Men's Casual Office & Wedding Party Dress Pants Business Suit Trousers in Mid Waist Cotton & Nylon Fabric;15.0;;;0;https://www.alibaba.com/product-detail/New-Arrival-Men-s-Casual-Office_1601201164115.html;1;Alibaba;2025-12-11;$;;;;False;;;;;;
High Quality Men's Slim Fit Dress Pants Custom Logo Cotton Blend Fabric Iron-Free Business Trousers Casual Straight Uniform;10.9;;;0;https://www.alibaba.com/product-detail/High-Quality-Men-s-Slim-Fit_62124681912.html;1;Alibaba;2025-12-11;$;;;;False;;;;;;
New Custom Flare Dress Pants for Women Stretch Wide Leg Suit Pants With Front Slit Hem Pants for Work;12.5;;;0;https://www.alibaba.com/product-detail/New-Custom-Flare-Dress-Pants-for_1600982531789.html;1;Alibaba;2025-12-11;$;;;;True;;;;;;
Oversized Formal Dress Pants Women Casual Office Business Dress Pants Breathable Plus Size Fashionable Dress Pant;6.0;;;0;https://www.alibaba.com/product-detail/Oversized-Formal-Dress-Pants-Women-Casual_10000019363119.html;1;Alibaba;2025-12-11;$;;;;False;;;;;;
Waffle Casual Dress Pants Men Spring and Autumn Business Formal Suit Pants Slim Feet Non-ironing Elastic Waist Suit Pants;7.7;;;0;https://www.alibaba.com/product-detail/Waffle-Casual-Dress-Pants-Men-Spring_1601239351809.html;1;Alibaba;2025-12-11;$;;;;True;;;;;;
2019 Cheapest Dress Pants Women;3.0;;;0;https://www.alibaba.com/product-detail/2019-Cheapest-Dress-Pants-Women_62470685083.html;1;Alibaba;2025-12-11;$;;;;False;;;;;;
Office Elegance Drapey Pleats Wide-Leg Slimming Relaxed Fit Curved Dress Pants;13.93;;;0;https://www.alibaba.com/product-detail/Office-Elegance-Drapey-Pleats-Wide-Leg_1601604422750.html;1;Alibaba;2025-12-11;$;;;;True;;;;;;
Spandex Woven Fabric Regular Fit Straight Formal Pants with Anti-Wrinkle Anti-Pilling Striped Pattern;8.48;;;0;https://www.alibaba.com/product-detail/Spandex-Woven-Fabric-Regular-Fit-Straight_1601612925960.html;1;Alibaba;2025-12-11;$;;;;False;;;;;;
New Men's Classic Straight Leg Business Suit Pants Solid Formal Occasion Office Pants Male;4.5;;;0;https://www.alibaba.com/product-detail/New-Men-s-Classic-Straight-Leg_1601427011264.html;1;Alibaba;2025-12-11;$;;;;False;;;;;;
Waffle Casual Dress Pants Men's Business Suit Pants Slim-fit Small Feet Non-ironing Superior Sense Suit Long Pants;6.8;;;0;https://www.alibaba.com/product-detail/Waffle-Casual-Dress-Pants-Men-s_1601220671960.html;1;Alibaba;2025-12-11;$;;;;False;;;;;;
New Style Mens Flannel Dress Pants Breathable Dress Pants OEM Cotton Trouser Casual Dress Pants for Men;11.0;;;0;https://www.alibaba.com/product-detail/New-Style-Mens-Flannel-Dress-Pants_1601567839938.html;1;Alibaba;2025-12-11;$;;;;False;;;;;;
Wholesale Men Dress Pants Solid Color Business Formal Slim Fit Classic Men's Trousers Office Pants for Men;9.49;;;0;https://www.alibaba.com/product-detail/Wholesale-Men-Dress-Pants-Solid-Color_1601564181934.html;1;Alibaba;2025-12-11;$;;;;False;;;;;;
OEM Elegant Women's Dress Pants in Genuine Leather, High Quality Finish;60.0;;;0;https://www.alibaba.com/product-detail/OEM-Elegant-Women-s-Dress-Pants_50031843685.html;1;Alibaba;2025-12-11;$;;;;False;;;;;;
Slim Fit Men's Dress Pants for Business Casual Wear | Youthful Style Suit Pants for Office and Formal Occasions;4.0;;;0;https://www.alibaba.com/product-detail/Slim-Fit-Men-s-Dress-Pants_1601297074504.html;1;Alibaba;2025-12-11;$;;;;False;;;;;;
Sustainable Men's E-CLO Baggy Suit Trousers Mid Waist Elastic Waist Business Office Loose Patchwork Stria Flat Front Dress Pant;16.43;;;0;https://www.alibaba.com/product-detail/Sustainable-Men-s-E-CLO-Baggy_1601626998926.html;1;Alibaba;2025-12-11;$;;;;False;;;;;;
Solid Color Casual Suit Pants Men High Waisted Custom Design Slim Pleated Business Formal Dress Men's Suit Pants;12.5;;;0;https://www.alibaba.com/product-detail/Solid-Color-Casual-Suit-Pants-Men_10000030411936.html;1;Alibaba;2025-12-11;$;;;;True;;;;;;
New Fashion Women Dress Pant Best Material Fully Customized Street Wear Top Trending High Quality Dress Pant with Cheap Rate;6.0;;;0;https://www.alibaba.com/product-detail/New-Fashion-Women-Dress-Pant-Best_10000025019585.html;1;Alibaba;2025-12-11;$;;;;False;;;;;;
2024 Men Business Suit Pants Formal Office Gentleman Suit Long Trousers Stretch Slim Straight Solid Color Casual Pants;5.0;;;0;https://www.alibaba.com/product-detail/2024-Men-Business-Suit-Pants-Formal_10000019893334.html;1;Alibaba;2025-12-11;$;;;;False;;;;;;
2025 Men's High Quality Slim Fit Dress Trousers Pants Comfortable Stretchable Front Flat Design for Office Formal Wear Straight;12.0;;;0;https://www.alibaba.com/product-detail/2025-Men-s-High-Quality-Slim_10000028743059.html;1;Alibaba;2025-12-11;$;;;;False;;;;;;
Best Quality Waist Stretch Formal Women's Female Office Dress Suit Pants Trousers Direct Factory Manufacture Export From BD;4.5;;;0;https://www.alibaba.com/product-detail/Best-Quality-Waist-Stretch-Formal-Women_11000011469397.html;1;Alibaba;2025-12-11;$;;;;False;;;;;;
New Casual Men Dress Pants Formal Trousers for Men and Women;7.0;;;0;https://www.alibaba.com/product-detail/New-Casual-Men-Dress-Pants-Formal_10000006257570.html;1;Alibaba;2025-12-11;$;;;;False;;;;;;
Mid Waist Women's Formal Dress Pants Knitted Breathable Quick Dry Back Hidden Zipper Summer;8.0;;;0;https://www.alibaba.com/product-detail/Mid-Waist-Women-s-Formal-Dress_10000029329725.html;1;Alibaba;2025-12-11;$;;;;False;;;;;;
2025 Custom Men's Slim Fit Dress Pants High Quality 100% Cotton Comfortable and Casual Style OEM Supported;16.0;;;0;https://www.alibaba.com/product-detail/2025-Custom-Men-s-Slim-Fit_10000030095758.html;1;Alibaba;2025-12-11;$;;;;False;;;;;;
Custom High Quality Men Blazer Dress Pants Slim Fit Stretch Casual Formal Male Skinny Work Smart Office Trousers for Men;7.32;;;0;https://www.alibaba.com/product-detail/Custom-High-Quality-Men-Blazer-Dress_1600736546417.html;1;Alibaba;2025-12-11;$;;;;True;;;;;;
Latest Design Trouser Men's Straight Pants Men's Slim Fit Office Formal Dress Trouser Men Stylish Slim Fit Trousers;8.99;;;0;https://www.alibaba.com/product-detail/Latest-Design-Trouser-Men-s-Straight_11000005229033.html;1;Alibaba;2025-12-11;$;;;;False;;;;;;
Men Business Loose Suit Pants Formal Office Formal Wear Suit Long Trousers Stretch Straight Bridegroom Solid Color Casual Pants;7.0;;;0;https://www.alibaba.com/product-detail/Men-Business-Loose-Suit-Pants-Formal_11000012923243.html;1;Alibaba;2025-12-11;$;;;;False;;;;;;
Best Selling Men's Dress Pants Fashionable Slim Fit Canvas Casual Wear Comfortable Lightweight Mid Waist Straight Pattern;10.0;;;0;https://www.alibaba.com/product-detail/Best-Selling-Men-s-Dress-Pants_10000030841672.html;1;Alibaba;2025-12-11;$;;;;False;;;;;;
Elegant Women Winter Season Trim Women Dress Pants Slim Fit Formal Style with Invisible Zipper and High Waist;8.99;;;0;https://www.alibaba.com/product-detail/Elegant-Women-Winter-Season-Trim-Women_11000028382885.html;1;Alibaba;2025-12-11;$;;;;False;;;;;;
Custom Blank Straight Slim Fit Men Dress Pant For Sale / Top Trending Casual Wear Dress Pants In Cheapest Price;12.0;;;0;https://www.alibaba.com/product-detail/Custom-Blank-Straight-Slim-Fit-Men_11000021751289.html;1;Alibaba;2025-12-11;$;;;;False;;;;;;
Men's Anti Static Worsted Suit Pants Premium Wool Blend Formal Slim Fit Professional Office Business Dress Trousers Workwear E;6.0;;;0;https://www.alibaba.com/product-detail/Men-s-Anti-Static-Worsted-Suit_10000036488934.html;1;Alibaba;2025-12-11;$;;;;False;;;;;;
New Men's Dress Pants Coffee Color Senior Sense Formal Business Suit Pants Summer Small Foot Drop Pants;6.99;;;0;https://www.alibaba.com/product-detail/New-Men-s-Dress-Pants-Coffee_1601222526043.html;1;Alibaba;2025-12-11;$;;;;False;;;;;;
RNSHANGER Men Suit Pants Formal Trousers Stretch Slim Pantalone Solid Color Casual Dress Pants Fashion Men Business Pants;10.8;;;0;https://www.alibaba.com/product-detail/RNSHANGER-Men-Suit-Pants-Formal-Trousers_1600978463305.html;1;Alibaba;2025-12-11;$;;;;False;;;;;;
Mens Business Pants High Quality Stretchable Formal Trousers Thick Autumn Winter Tailored Suit Office Clothes Work Pants;12.71;;;0;https://www.alibaba.com/product-detail/Mens-Business-Pants-High-Quality-Stretchable_1600944281853.html;1;Alibaba;2025-12-11;$;;;;False;;;;;;
Men Fashion Solid Color Business Suit Pants / Men Groom Wedding Dress Suit Pants Mens Trousers;10.0;;;0;https://www.alibaba.com/product-detail/Men-Fashion-Solid-Color-Business-Suit_1600989169428.html;1;Alibaba;2025-12-11;$;;;;False;;;;;;
Men's Custom Made Classic Fit Wool Dress Pants Mid Waist Button Fly Straight Formal Wedding & Office Business Groom Trousers;165.0;;;0;https://www.alibaba.com/product-detail/Men-s-Custom-Made-Classic-Fit_1601401324202.html;1;Alibaba;2025-12-11;$;;;;False;;;;;;
Waffle Casual Dress Pants Men's Business Suit Pants Slim-fit Small Feet Non-ironing Superior Sense Suit Long Pants;7.1;;;0;https://www.alibaba.com/product-detail/Waffle-Casual-Dress-Pants-Men-s_1601395148507.html;1;Alibaba;2025-12-11;$;;;;False;;;;;;
Summer Drop Sense of Solid Color Small Dress Pants Men's British Slim Feet Casual Pants Business Long Suit Pants;7.85;;;0;https://www.alibaba.com/product-detail/Summer-Drop-Sense-of-Solid-Color_1600990844693.html;1;Alibaba;2025-12-11;$;;;;True;;;;;;
Burgundy Men's Trousers Straight Solid Color Suit Pants Men's Business Formal Casual Trousers;5.9;;;0;https://www.alibaba.com/product-detail/Burgundy-Men-s-Trousers-Straight-Solid_1601490537984.html;1;Alibaba;2025-12-11;$;;;;False;;;;;;
Waffle Casual Dress Pants Men Spring and Autumn Business Formal Suit Pants Slim Feet Non-ironing Elastic Waist Suit Pants;6.98;;;0;https://www.alibaba.com/product-detail/Waffle-Casual-Dress-Pants-Men-Spring_1601433421727.html;1;Alibaba;2025-12-11;$;;;;False;;;;;;
Waffle Casual Dress Pants Men Spring and Autumn Business Formal Suit Pants Slim Feet Non-ironing Elastic Waist Suit Pants;6.65;;;0;https://www.alibaba.com/product-detail/Waffle-Casual-Dress-Pants-Men-Spring_1601388507840.html;1;Alibaba;2025-12-11;$;;;;False;;;;;;
Popular New Casual Dress Pants Solid Color Nine-point Pants Fashion Men's Dress Pants;7.85;;;0;https://www.alibaba.com/product-detail/Popular-New-Casual-Dress-Pants-Solid_1601396301857.html;1;Alibaba;2025-12-11;$;;;;False;;;;;;
Fashion Office Social Solid Wedding Party Slim Fit Suit Pants for Men High Quality Formal Dress Pants;12.8;;;0;https://www.alibaba.com/product-detail/Fashion-Office-Social-Solid-Wedding-Party_1601624907439.html;1;Alibaba;2025-12-11;$;;;;False;;;;;;
LARSUR Custom Factory Wrinkle-Free Causal Business Dress Trousers Denim Gurkha Naples Italian Style Pleated Chino Suit Pants;15.0;;;0;https://www.alibaba.com/product-detail/LARSUR-Custom-Factory-Wrinkle-Free-Causal_1601583839836.html;1;Alibaba;2025-12-11;$;;;;True;;;;;;
Custom High Quality Dress Pants for Men Spandex Blend Comfortable Slim Fit Business Casual Office Trousers Male Dress Pants;5.45;;;0;https://www.alibaba.com/product-detail/Custom-High-Quality-Dress-Pants-for_1601417828025.html;1;Alibaba;2025-12-11;$;;;;True;;;;;;
2025 New Dress Pants Men Slim Business Dress Casual Pants Small Feet Hanging Suit Pants;14.59;;;0;https://www.alibaba.com/product-detail/2025-New-Dress-Pants-Men-Slim_1601504291651.html;1;Alibaba;2025-12-11;$;;;;False;;;;;;
2025 Custom Men's Slim Fit Dress Pants High Quality 100% Cotton Comfortable and Casual Style OEM Supported;16.0;;;0;https://www.alibaba.com/product-detail/2025-Custom-Men-s-Slim-Fit_10000030095758.html;2;Alibaba;2025-12-11;$;;;;False;;;;;;
Wholesale Blank Custom Logo Stacked Sweat Pants Men's Joggers Sports Jogger Stacked Sweat Trousers For Men;4.9;;;0;https://www.alibaba.com/product-detail/Wholesale-Blank-Custom-Logo-Stacked-Sweat_1600863213696.html?s=p;2;Alibaba;2025-12-11;$;;;;True;;;;;;
Custom High Quality Men Blazer Dress Pants Slim Fit Stretch Casual Formal Male Skinny Work Smart Office Trousers for Men;7.32;;;0;https://www.alibaba.com/product-detail/Custom-High-Quality-Men-Blazer-Dress_1600736546417.html;2;Alibaba;2025-12-11;$;;;;True;;;;;;
Summer New Style Bohemian Style Paisley Printed Wide Leg Pants Fashion Straight Tube Elastic Waist Casual Pants;6.14;;;0;https://www.alibaba.com/product-detail/Summer-New-Style-Bohemian-Style-Paisley_1601486667076.html?s=p;2;Alibaba;2025-12-11;$;;;;False;;;;;;
Latest Design Trouser Men's Straight Pants Men's Slim Fit Office Formal Dress Trouser Men Stylish Slim Fit Trousers;8.99;;;0;https://www.alibaba.com/product-detail/Latest-Design-Trouser-Men-s-Straight_11000005229033.html;2;Alibaba;2025-12-11;$;;;;False;;;;;;
In Stock White Attractive Pants Breathable Polyester Spandex Jodhpur Men's Breeches Horse Equestrian Clothing By Horsekraft;25.0;;;0;https://www.alibaba.com/product-detail/In-Stock-White-Attractive-Pants-Breathable_1601630685283.html?s=p;2;Alibaba;2025-12-11;$;;;;False;;;;;;
Men Business Loose Suit Pants Formal Office Formal Wear Suit Long Trousers Stretch Straight Bridegroom Solid Color Casual Pants;7.0;;;0;https://www.alibaba.com/product-detail/Men-Business-Loose-Suit-Pants-Formal_11000012923243.html;2;Alibaba;2025-12-11;$;;;;False;;;;;;
Unisex Outdoor Sports Protective Gear Ice Hockey Pants With Protector Shell And Hip Pad For Skiing And Ice Hockey;18.0;;;0;https://www.alibaba.com/product-detail/Unisex-Outdoor-Sports-Protective-Gear-Ice_1601358595544.html?s=p;2;Alibaba;2025-12-11;$;;;;False;;;;;;
Bulk Formal Dress Pants for Men Simple Plain Slim Fit Trousers Men's Work Wedding Banquet Business Office Pants;8.0;;;0;https://www.alibaba.com/product-detail/Bulk-Formal-Dress-Pants-for-Men_50035867173.html;2;Alibaba;2025-12-11;$;;;;False;;;;;;
OEM Professional Restaurant Chef Uniform Kitchen Cooking Pants Unisex Look Baggy Fit Stripe Pants With Tapered Legs;6.0;;;0;https://www.alibaba.com/product-detail/OEM-Professional-Restaurant-Chef-Uniform-Kitchen_1601617372530.html?s=p;2;Alibaba;2025-12-11;$;;;;True;;;;;;
Best Selling Men's Dress Pants Fashionable Slim Fit Canvas Casual Wear Comfortable Lightweight Mid Waist Straight Pattern;10.0;;;0;https://www.alibaba.com/product-detail/Best-Selling-Men-s-Dress-Pants_10000030841672.html;2;Alibaba;2025-12-11;$;;;;False;;;;;;
Unisex V-Neck Scrubs Top & Cargo Pants Set 12 Pockets Yoga Waistband 4-Way Stretch Breathable Wrinkle Resistant Twill Fabric;7.53;;;0;https://www.alibaba.com/product-detail/Unisex-V-Neck-Scrubs-Top-Cargo_1601619268338.html?s=p;2;Alibaba;2025-12-11;$;;;;True;;;;;;
Elegant Women Winter Season Trim Women Dress Pants Slim Fit Formal Style with Invisible Zipper and High Waist;8.99;;;0;https://www.alibaba.com/product-detail/Elegant-Women-Winter-Season-Trim-Women_11000028382885.html;2;Alibaba;2025-12-11;$;;;;False;;;;;;
French Terry Jogger Sweat Pants Wholesale Custom Mens Fitness Sport Pants Running Trousers Custom Blank Plus Size Pants;9.9;;;0;https://www.alibaba.com/product-detail/French-Terry-Jogger-Sweat-Pants-Wholesale_1600663957637.html?s=p;2;Alibaba;2025-12-11;$;;;;False;;;;;;
Custom Blank Straight Slim Fit Men Dress Pant For Sale / Top Trending Casual Wear Dress Pants In Cheapest Price;12.0;;;0;https://www.alibaba.com/product-detail/Custom-Blank-Straight-Slim-Fit-Men_11000021751289.html;2;Alibaba;2025-12-11;$;;;;False;;;;;;
Latest Design Bamboo Cotton Pants Men Trousers Oversized Baggy Track Sweatpants Men;11.0;;;0;https://www.alibaba.com/product-detail/Latest-Design-Bamboo-Cotton-Pants-Men_1601276754433.html?s=p;2;Alibaba;2025-12-11;$;;;;True;;;;;;
Business Casual Suit Pants Trousers for Women Breathable Wide Leg Baggy Womens Clothing Casual Dresses Women's Dresses;7.3;;;0;https://www.alibaba.com/product-detail/Business-Casual-Suit-Pants-Trousers-for_1601228051858.html;2;Alibaba;2025-12-11;$;;;;False;;;;;;
High Collar Black Latin Dance Leotard Loose Pants Set Backless Jazz Top Mesh Samba Rumba Tango Dance Wear Costume For Girls;5.57;;;0;https://www.alibaba.com/product-detail/High-Collar-Black-Latin-Dance-Leotard_1601617057937.html?s=p;2;Alibaba;2025-12-11;$;;;;False;;;;;;
Men's Anti Static Worsted Suit Pants Premium Wool Blend Formal Slim Fit Professional Office Business Dress Trousers Workwear E;6.0;;;0;https://www.alibaba.com/product-detail/Men-s-Anti-Static-Worsted-Suit_10000036488934.html;2;Alibaba;2025-12-11;$;;;;False;;;;;;
Hot Sale Equestrian Nylon Woman Horse Racing Breeches Tights Knee Patch Professional Competition High Waist Pocket Leggings Pant;25.0;;;0;https://www.alibaba.com/product-detail/Hot-Sale-Equestrian-Nylon-Woman-Horse_1601630606983.html?s=p;2;Alibaba;2025-12-11;$;;;;False;;;;;;
RNSHANGER Men Suit Pants Formal Trousers Stretch Slim Pantalone Solid Color Casual Dress Pants Fashion Men Business Pants;10.8;;;0;https://www.alibaba.com/product-detail/RNSHANGER-Men-Suit-Pants-Formal-Trousers_1600978463305.html;2;Alibaba;2025-12-11;$;;;;False;;;;;;
OEM High Rise Slim Straight White Cropped Denim Pants For Women Breathable Embroidered Jeans With Tassel Rivet Waist Decoration;16.3;;;0;https://www.alibaba.com/product-detail/OEM-High-Rise-Slim-Straight-White_1601201043952.html?s=p;2;Alibaba;2025-12-11;$;;;;False;;;;;;
2024 Spring Summer New Draping Dress Pants Business Slim Pants Men's Straight Leg Nine-point Suit Pants;6.55;;;0;https://www.alibaba.com/product-detail/2024-Spring-Summer-New-Draping-Dress_1601022554577.html;2;Alibaba;2025-12-11;$;;;;True;;;;;;
Casual Loose Slimming Fitness Drawstring Waistband Straight Wide Leg High Waist Gym Yoga Sports Pants For Women;10.73;;;0;https://www.alibaba.com/product-detail/Casual-Loose-Slimming-Fitness-Drawstring-Waistband_1601503848371.html?s=p;2;Alibaba;2025-12-11;$;;;;True;;;;;;
New Men's Dress Pants Coffee Color Senior Sense Formal Business Suit Pants Summer Small Foot Drop Pants;6.99;;;0;https://www.alibaba.com/product-detail/New-Men-s-Dress-Pants-Coffee_1601222526043.html;2;Alibaba;2025-12-11;$;;;;False;;;;;;
OEM/ODM Custom Light Blue Mid-Rise Cigarette For Women Soft Stretch Denim Breathable Cotton Ankle Crop Left-Hand Pencil Pants;16.9;;;0;https://www.alibaba.com/product-detail/OEM-ODM-Custom-Light-Blue-Mid_1601230985264.html?s=p;2;Alibaba;2025-12-11;$;;;;False;;;;;;
Solid Color Casual Suit Pants for Men's Summer High Waisted Straight Leg Trousers Slim Pleated Business Formal Dress Pants Man;19.9;;;0;https://www.alibaba.com/product-detail/Solid-Color-Casual-Suit-Pants-for_1600919328003.html;2;Alibaba;2025-12-11;$;;;;False;;;;;;
2025 Men's Premium Gray Cotton Wool Casual Business Drawstring Closure Mid-Thickness Elastic Waist Pants Ultra-Soft Warm Fabric;25.88;;;0;https://www.alibaba.com/product-detail/2025-Men-s-Premium-Gray-Cotton_1601426570866.html?s=p;2;Alibaba;2025-12-11;$;;;;False;;;;;;
Mens Business Pants High Quality Stretchable Formal Trousers Thick Autumn Winter Tailored Suit Office Clothes Work Pants;12.71;;;0;https://www.alibaba.com/product-detail/Mens-Business-Pants-High-Quality-Stretchable_1600944281853.html;2;Alibaba;2025-12-11;$;;;;False;;;;;;
Custom Men's Baseball Uniform Set Breathable Sports Custom Sublimated Pants Design Printed For Team Men;14.0;;;0;https://www.alibaba.com/product-detail/Custom-Men-s-Baseball-Uniform-Set_1601214418236.html?s=p;2;Alibaba;2025-12-11;$;;;;False;;;;;;
Men's Custom Made Classic Fit Wool Dress Pants Mid Waist Button Fly Straight Formal Wedding & Office Business Groom Trousers;165.0;;;0;https://www.alibaba.com/product-detail/Men-s-Custom-Made-Classic-Fit_1601401324202.html;2;Alibaba;2025-12-11;$;;;;False;;;;;;
Custom Cargo Workwear Multi Pockets Pants Construction Work Trousers Safety Security Guard Work Hi-vis Pants;17.9;;;0;https://www.alibaba.com/product-detail/Custom-Cargo-Workwear-Multi-Pockets-Pants_11000010110827.html?s=p;2;Alibaba;2025-12-11;$;;;;True;;;;;;
Waffle Casual Dress Pants Men's Business Suit Pants Slim-fit Small Feet Non-ironing Superior Sense Suit Long Pants;7.1;;;0;https://www.alibaba.com/product-detail/Waffle-Casual-Dress-Pants-Men-s_1601395148507.html;2;Alibaba;2025-12-11;$;;;;False;;;;;;
High Quality Customizable Logo Navy Taekwondo Pants Dobok Uniform For Adults Male Female Youth Martial Arts;5.58;;;0;https://www.alibaba.com/product-detail/High-Quality-Customizable-Logo-Navy-Taekwondo_1601574136465.html?s=p;2;Alibaba;2025-12-11;$;;;;True;;;;;;
Burgundy Men's Trousers Straight Solid Color Suit Pants Men's Business Formal Casual Trousers;5.9;;;0;https://www.alibaba.com/product-detail/Burgundy-Men-s-Trousers-Straight-Solid_1601490537984.html;2;Alibaba;2025-12-11;$;;;;False;;;;;;
Women Can Customize Logo Plus Size Lamb Cashmere And Wool Fabric Autumn And Winter Warm Casual Pants;9.5;;;0;https://www.alibaba.com/product-detail/Women-Can-Customize-Logo-Plus-Size_1600289604233.html?s=p;2;Alibaba;2025-12-11;$;;;;False;;;;;;
Waffle Casual Dress Pants Men Spring and Autumn Business Formal Suit Pants Slim Feet Non-ironing Elastic Waist Suit Pants;6.98;;;0;https://www.alibaba.com/product-detail/Waffle-Casual-Dress-Pants-Men-Spring_1601433421727.html;2;Alibaba;2025-12-11;$;;;;False;;;;;;
Firefighter Suit Jacket Pants Flame Retardant EN469 Nomex Aramid Fire Fireman Uniforms Firefighting Clothing Gear Factory Supply;280.0;;;0;https://www.alibaba.com/product-detail/Firefighter-Suit-Jacket-Pants-Flame-Retardant_1601298682156.html?s=p;2;Alibaba;2025-12-11;$;;;;True;;;;;;
Fashion Office Social Solid Wedding Party Slim Fit Suit Pants for Men High Quality Formal Dress Pants;12.8;;;0;https://www.alibaba.com/product-detail/Fashion-Office-Social-Solid-Wedding-Party_1601624907439.html;2;Alibaba;2025-12-11;$;;;;False;;;;;;
"Custom Women High-Rise Slim Straight Jeans, 32"" Inseam, 9oz Stretch Black Denim, Faded Look, Power Stretch, OEM/ODM";14.6;;;0;https://www.alibaba.com/product-detail/Custom-Women-High-Rise-Slim-Straight_1601205276328.html?s=p;2;Alibaba;2025-12-11;$;;;;False;;;;;;
LARSUR Custom Factory Wrinkle-Free Causal Business Dress Trousers Denim Gurkha Naples Italian Style Pleated Chino Suit Pants;15.0;;;0;https://www.alibaba.com/product-detail/LARSUR-Custom-Factory-Wrinkle-Free-Causal_1601583839836.html;2;Alibaba;2025-12-11;$;;;;True;;;;;;
Unisex Scrubs Set 7 Pocket V-Neck Breathable Twill Fabric Stretch Jogger Pants Wrinkle Resistant Medical Workwear For Nurses Pet;7.25;;;0;https://www.alibaba.com/product-detail/Unisex-Scrubs-Set-7-Pocket-V_1601616037606.html?s=p;2;Alibaba;2025-12-11;$;;;;True;;;;;;
2025 New Dress Pants Men Slim Business Dress Casual Pants Small Feet Hanging Suit Pants;14.59;;;0;https://www.alibaba.com/product-detail/2025-New-Dress-Pants-Men-Slim_1601504291651.html;2;Alibaba;2025-12-11;$;;;;False;;;;;;
Design Personalized Boys Printed Baseball Uniform Sports Customize Sublimated Baseball Wear Softball Pants For Team;14.0;;;0;https://www.alibaba.com/product-detail/Design-Personalized-Boys-Printed-Baseball-Uniform_1601214289789.html?s=p;2;Alibaba;2025-12-11;$;;;;False;;;;;;
High Quality 95% Polyester 5% Spandex Spring Summer Plus Size Stretchy Straight Leg Business Slacks Formal Dress Pants For Men;7.35;;;0;https://www.alibaba.com/product-detail/High-Quality-95-Polyester-5-Spandex_10000034529239.html;2;Alibaba;2025-12-11;$;;;;True;;;;;;
Lightweight Eco-Friendly PU Leather Pants Breathable And Elastic For All-Day Comfort And Decorative Garments;0.85;;;0;https://www.alibaba.com/product-detail/Lightweight-Eco-Friendly-PU-Leather-Pants_1601451066681.html?s=p;2;Alibaba;2025-12-11;$;;;;True;;;;;;
Hot Selling Casual Flat Front Women's Dress Pants in Soft Wool/Cotton Fabric Breathable Design with Custom Size & High Quality;10.0;;;0;https://www.alibaba.com/product-detail/Hot-Selling-Casual-Flat-Front-Women_11000021508633.html;2;Alibaba;2025-12-11;$;;;;False;;;;;;
Fashionable Stretch Two Piece Sets Men Scrubs Uniforms Hospital Doctor Workkwear Top & Pants With Multi Pocket Medical Scrubs;10.68;;;0;https://www.alibaba.com/product-detail/Fashionable-Stretch-Two-Piece-Sets-Men_1601572228658.html?s=p;2;Alibaba;2025-12-11;$;;;;True;;;;;;
High Quality Lady Wear High-waist Wide-leg Dress Pants Black Tailored Pants for Women Elastic Casual Trousers;9.89;;;0;https://www.alibaba.com/product-detail/High-Quality-Lady-Wear-High-waist_1601200573947.html;3;Alibaba;2025-12-11;$;;;;False;;;;;;
Jeans Manufacturer Custom Designer High Waist Straight Solid Medium Wash Breathable Casual Denim Pant Men;19.0;;;0;https://www.alibaba.com/product-detail/Jeans-Manufacturer-Custom-Designer-High-Waist_1601550920377.html?s=p;3;Alibaba;2025-12-11;$;;;;False;;;;;;
Hot Sale Mens Suits Pants Formal Business Latest Black Color Dress Trousers for Men;10.8;;;0;https://www.alibaba.com/product-detail/Hot-Sale-Mens-Suits-Pants-Formal_1600067867179.html;3;Alibaba;2025-12-11;$;;;;False;;;;;;
Premium Custom Japanese Selvedge Raw Denim Men's Jean Low MOQ Red Edge 100% Cotton Jean Wholesale Raw Selvedge Denim Baggy Jeans;28.0;;;0;https://www.alibaba.com/product-detail/Premium-Custom-Japanese-Selvedge-Raw-Denim_1601490560622.html?s=p;3;Alibaba;2025-12-11;$;;;;True;;;;;;
High Quality Dress Suit Pants Office Official Wear Suiting Men Trousers;14.0;;;0;https://www.alibaba.com/product-detail/High-Quality-Dress-Suit-Pants-Office_1600334308303.html;3;Alibaba;2025-12-11;$;;;;False;;;;;;
