titulo;precio;precio_original;descuento;ventas;link;pagina;plataforma;fecha_scraping;moneda;proveedor;proveedor_anios;proveedor_pais;proveedor_verificado;rating_score;rating_count;moq;moq_texto;envio_promesa;tasa_repeticion
High Quality Cotton Fleece Grey Sweatpants For Men Vintage Style Straight Adjustable String Heather Joggers Pants For Autumn;17.8;;;0;https://www.alibaba.com/product-detail/High-Quality-Cotton-Fleece-Grey-Sweatpants_1601511773306.html?s=p;3;Alibaba;2025-12-11;$;;;;False;;;;;;
Wholesale Men Dress Pants Solid Color Business Formal Slim Fit Classic Men's Trousers Office Pants for Men;9.49;;;0;https://www.alibaba.com/product-detail/Wholesale-Men-Dress-Pants-Solid-Color_1601564181934.html;3;Alibaba;2025-12-11;$;;;;False;;;;;;
Men's Customized Jeans Letters Printed Denim Pants Trendy Men's Cargo Denim Straight Jean;15.1;;;0;https://www.alibaba.com/product-detail/Men-s-Customized-Jeans-Letters-Printed_1600627409615.html?s=p;3;Alibaba;2025-12-11;$;;;;True;;;;;;
2025 Men's High Quality Double Breasted Formal Wedding Business Casual Suit Pants Custom Viscose/Polyester Button Fly Closure;52.0;;;0;https://www.alibaba.com/product-detail/2025-Men-s-High-Quality-Double_1601589839752.html;3;Alibaba;2025-12-11;$;;;;True;;;;;;
Wholesale Manufacture Primary Junior School Uniform Boys Formal Trouser School Pants Design With Picture Logo Long Pant;7.6;;;0;https://www.alibaba.com/product-detail/Wholesale-Manufacture-Primary-Junior-School-Uniform_1601357711924.html?s=p;3;Alibaba;2025-12-11;$;;;;True;;;;;;
2024 New Stylish Men's Slim Fit Stripe Dress Pants Business Formal Casual Office Skinny Stretch Suit Flat Front Garment Dyed;24.89;;;0;https://www.alibaba.com/product-detail/2024-New-Stylish-Men-s-Slim_11000029005543.html;3;Alibaba;2025-12-11;$;;;;False;;;;;;
High Quality Customizable Waxed Men Denim Flare Jeans Pants;34.0;;;0;https://www.alibaba.com/product-detail/High-Quality-Customizable-Waxed-Men-Denim_1601143541676.html?s=p;3;Alibaba;2025-12-11;$;;;;True;;;;;;
New Fashion Women Dress Pant Best Material Fully Customized Street Wear Top Trending High Quality Dress Pant with Cheap Rate;6.0;;;0;https://www.alibaba.com/product-detail/New-Fashion-Women-Dress-Pant-Best_10000025019585.html;3;Alibaba;2025-12-11;$;;;;False;;;;;;
Track Pants Manufacturer Custom 350Gsm Mid Casual Baggy Oversized Sweatpants Flares Wide Leg Drawstring Closure Heavyweight 100%;12.78;;;0;https://www.alibaba.com/product-detail/Track-Pants-Manufacturer-Custom-350Gsm-Mid_1601561875240.html?s=p;3;Alibaba;2025-12-11;$;;;;False;;;;;;
New Men's Dress Pants Coffee Color Senior Sense Formal Business Suit Pants Summer Small Foot Drop Pants;6.91;;;0;https://www.alibaba.com/product-detail/New-Men-s-Dress-Pants-Coffee_1601625499987.html;3;Alibaba;2025-12-11;$;;;;False;;;;;;
In Stock Women's Phone Pockets Equestrian Leggings Outdoor 4 Way Stretch Horse Riding Breeches Jodhpurs Ladies Pants Sportswear;23.0;;;0;https://www.alibaba.com/product-detail/In-Stock-Women-s-Phone-Pockets_1601631659345.html?s=p;3;Alibaba;2025-12-11;$;;;;False;;;;;;
Hot Selling Men's Slim Fit Dress Pants Casual Business Lightweight Straight Formal Gentleman Trousers Comfort Stretch Waist Logo;5.0;;;0;https://www.alibaba.com/product-detail/Hot-Selling-Men-s-Slim-Fit_1601614828638.html;3;Alibaba;2025-12-11;$;;;;False;;;;;;
Factory Custom Design Student Boys School Uniforms Easy Plants School Trousers Gray Long Pants School Boy And Girls Trousers;7.3;;;0;https://www.alibaba.com/product-detail/Factory-Custom-Design-Student-Boys-School_1601408021288.html?s=p;3;Alibaba;2025-12-11;$;;;;True;;;;;;
High Quality Men's Straight Trousers Slim Fit Long Solid Color Casual Wear Formal Suit Pants Made of Cotton and Nylon Fabric;15.0;;;0;https://www.alibaba.com/product-detail/High-Quality-Men-s-Straight-Trousers_1601015240950.html;3;Alibaba;2025-12-11;$;;;;False;;;;;;
Women's Oversized Terry Fleece Joggers With Wide Legs Cargo Pants Featuring Pattern Decoration Dark Washed French Terry Material;11.0;;;0;https://www.alibaba.com/product-detail/Women-s-Oversized-Terry-Fleece-Joggers_1601286010756.html?s=p;3;Alibaba;2025-12-11;$;;;;True;;;;;;
Custom High Quality Dress Pants for Men Spandex Blend Comfortable Slim Fit Business Casual Office Trousers Male Dress Pants;5.45;;;0;https://www.alibaba.com/product-detail/Custom-High-Quality-Dress-Pants-for_1601417828025.html;3;Alibaba;2025-12-11;$;;;;True;;;;;;
Factory Wholesale Primary Junior School Uniform Boys And Girls Student Formal Trouser School Plaids Pants Design Custom;7.6;;;0;https://www.alibaba.com/product-detail/Factory-Wholesale-Primary-Junior-School-Uniform_1601358556032.html?s=p;3;Alibaba;2025-12-11;$;;;;True;;;;;;
Dress Pants Men's Straight Leg Loose Sag Casual Pants High Sense Business Suit Pants;8.3;;;0;https://www.alibaba.com/product-detail/Dress-Pants-Men-s-Straight-Leg_1600950251704.html;3;Alibaba;2025-12-11;$;;;;True;;;;;;
Women's Custom Joggers Tapered Leg Cargo Pants High Waist Quick Dry XL Size Winter Summer 89% Polyester 11% Spandex Loose;11.0;;;0;https://www.alibaba.com/product-detail/Women-s-Custom-Joggers-Tapered-Leg_1600211932526.html?s=p;3;Alibaba;2025-12-11;$;;;;True;;;;;;
Premium Slim Fit Men's Dress Pants for Business Office Wear Modern Tailored Formal Trousers with Stretch Fabric Suit Pants;2.48;;;0;https://www.alibaba.com/product-detail/Premium-Slim-Fit-Men-s-Dress_1601424987204.html;3;Alibaba;2025-12-11;$;;;;False;;;;;;
Men Riding Breeches Full Seat Knee Seat Stretch Riding Pants Man Breeches;29.75;;;0;https://www.alibaba.com/product-detail/Men-Riding-Breeches-Full-Seat-Knee_1600209498803.html?s=p;3;Alibaba;2025-12-11;$;;;;False;;;;;;
High Sense of High-waisted Dress Pants Men Business Casual with Fashion British Style Straight Leg Suit Pants;11.99;;;0;https://www.alibaba.com/product-detail/High-Sense-of-High-waisted-Dress_1601037873209.html;3;Alibaba;2025-12-11;$;;;;False;;;;;;
Latest Design RTS Wholesale Latest Design Clothing Outfit Print Comfortable Long-sleeved Long Pants Set Print Outfits Hot Sale;5.95;;;0;https://www.alibaba.com/product-detail/Latest-Design-RTS-Wholesale-Latest-Design_1601643656547.html?s=p;3;Alibaba;2025-12-11;$;;;;False;;;;;;
Waffle Casual Dress Pants Men Spring and Autumn Business Formal Suit Pants Slim Feet Non-ironing Elastic Waist Suit Pants;5.8;;;0;https://www.alibaba.com/product-detail/Waffle-Casual-Dress-Pants-Men-Spring_1601416830695.html;3;Alibaba;2025-12-11;$;;;;False;;;;;;
Women's Wide Leg Sweatpants Joggers With Button Decoration Logo Pattern Long Sleeves Thick Knitted Cargo Pants Washed Technics;11.0;;;0;https://www.alibaba.com/product-detail/Women-s-Wide-Leg-Sweatpants-Joggers_1601286083471.html?s=p;3;Alibaba;2025-12-11;$;;;;True;;;;;;
Wholesale Mens Slim Fit Dress Trousers High Quality Straight Office Suit Pants for Men;7.19;;;0;https://www.alibaba.com/product-detail/Wholesale-Mens-Slim-Fit-Dress-Trousers_1601599707213.html;3;Alibaba;2025-12-11;$;;;;True;;;;;;
Custom Logo Wool Sweatpants Men Running Sports Jogger Pants Sherpa Lined Fleece Trackpants Plus Size Mens Trousers;12.8;;;0;https://www.alibaba.com/product-detail/Custom-Logo-Wool-Sweatpants-Men-Running_1600700840397.html?s=p;3;Alibaba;2025-12-11;$;;;;False;;;;;;
New Fashion Slim Fit Skinny Dress Pants for Men's Wrinkle Free Formal Suit Pant Business Golf Dress Pants;8.6;;;0;https://www.alibaba.com/product-detail/New-Fashion-Slim-Fit-Skinny-Dress_1600957072605.html;3;Alibaba;2025-12-11;$;;;;False;;;;;;
High Quality Cotton Thicken Fleece Sweatpants Unisex Blank Purple Men Woman's Pants Trousers For Lovers;9.0;;;0;https://www.alibaba.com/product-detail/High-Quality-Cotton-Thicken-Fleece-Sweatpants_1601259995046.html?s=p;3;Alibaba;2025-12-11;$;;;;True;;;;;;
OEM Men Formal Dress Pants Straight High Waist Slim Suit Trousers Business Best Quality Wholesale Trouser for Women Breathable;7.99;;;0;https://www.alibaba.com/product-detail/OEM-Men-Formal-Dress-Pants-Straight_10000025697360.html;3;Alibaba;2025-12-11;$;;;;False;;;;;;
Unisex Fleece Lined Denim Pants Polyester/Cotton Washed Windproof Straight Full-Length Casual Winter Wear 6-13y ODM/OEM Service;10.53;;;0;https://www.alibaba.com/product-detail/Unisex-Fleece-Lined-Denim-Pants-Polyester_1601632764327.html?s=p;3;Alibaba;2025-12-11;$;;;;False;;;;;;
2025 Women Leather Dress Pants Top Quality Leather Women's Pant 2025 Low MOQ Women Leather Pants;14.0;;;0;https://www.alibaba.com/product-detail/2025-Women-Leather-Dress-Pants-Top_10000024474054.html;3;Alibaba;2025-12-11;$;;;;False;;;;;;
Men's Summer Sports Pants Breathable Quick-Drying Casual Pants For Basketball & Running Solid Pattern Loose Fit;7.84;;;0;https://www.alibaba.com/product-detail/Men-s-Summer-Sports-Pants-Breathable_1601541663202.html?s=p;3;Alibaba;2025-12-11;$;;;;False;;;;;;
2024 Women's High Quality Breathable Leather Dress Pants Customizable Low MOQ Flat Front Winter Style;8.0;;;0;https://www.alibaba.com/product-detail/2024-Women-s-High-Quality-Breathable_10000017662376.html;3;Alibaba;2025-12-11;$;;;;False;;;;;;
42109 Custom Jogger Pants V-Neck Plus Plush Men's Coat Work Clothes Scrub For Medical Laboratory Scientist;4.22;;;0;https://www.alibaba.com/product-detail/42109-Custom-Jogger-Pants-V-Neck_1601557585724.html?s=p;3;Alibaba;2025-12-11;$;;;;False;;;;;;
Nayil Men's High Dress Pants Coffee Color Casual Button Light Worsed Senior Sense Formal Business Suit Pants for Summer;11.4;;;0;https://www.alibaba.com/product-detail/Nayil-Men-s-High-Dress-Pants_1601569225301.html;3;Alibaba;2025-12-11;$;;;;False;;;;;;
Polyester Hospital Disposable Maternity Breathable Mesh Pants For Women And Men;0.52;;;0;https://www.alibaba.com/product-detail/Polyester-Hospital-Disposable-Maternity-Breathable-Mesh_1601232719089.html?s=p;3;Alibaba;2025-12-11;$;;;;False;;;;;;
Heavyweight Patchwork Classic Fit Dress Trousers Elasticized Waist 100% Organic Cotton Casual Business Pants for Men;15.29;;;0;https://www.alibaba.com/product-detail/Heavyweight-Patchwork-Classic-Fit-Dress-Trousers_1601627103469.html;3;Alibaba;2025-12-11;$;;;;False;;;;;;
Organic Stretch Heavyweight Combed Twill Fabric Soft Cotton Nylon Modal Blend Clean Face Tailored Men's Women's Pants Boys Girls;5.88;;;0;https://www.alibaba.com/product-detail/Organic-Stretch-Heavyweight-Combed-Twill-Fabric_1601602999513.html?s=p;3;Alibaba;2025-12-11;$;;;;False;;;;;;
Women's High Waist Wide Leg Dress Pants | Elegant Office Trouser with Front Pleats & Tailored Fit | ODM Workwear Manufacturer;6.0;;;0;https://www.alibaba.com/product-detail/Women-s-High-Waist-Wide-Leg_1601628034708.html;3;Alibaba;2025-12-11;$;;;;False;;;;;;
RTS Clothing Outfit Latest Design Clothing Outfit Print Western Style Comfortable Long-sleeved Long Pants Set Outfits Hot Sale;5.95;;;0;https://www.alibaba.com/product-detail/RTS-Clothing-Outfit-Latest-Design-Clothing_1601643748295.html?s=p;3;Alibaba;2025-12-11;$;;;;False;;;;;;
Men's High Waist Ultra Draping Striped Dress Pants Pleated Front Slim Fit Wool Trousers Plus Size Wrinkle-Resistant Easy Care;15.0;;;0;https://www.alibaba.com/product-detail/Men-s-High-Waist-Ultra-Draping_1601421199347.html;3;Alibaba;2025-12-11;$;;;;False;;;;;;
High Quality Acid Wash Vintage Jogger Sweatpants Custom Oversized Heavy Weight 100% Cotton Straight Baggy Streetwear Sweat Pants;28.8;;;0;https://www.alibaba.com/product-detail/High-Quality-Acid-Wash-Vintage-Jogger_1601603709009.html?s=p;3;Alibaba;2025-12-11;$;;;;True;;;;;;
2025 Men's Slim Fit Office Formal Dress Trousers Pants High Quality Comfortable Stretchable Mid Waist Straight Front Breathable;12.0;;;0;https://www.alibaba.com/product-detail/2025-Men-s-Slim-Fit-Office_10000028754019.html;4;Alibaba;2025-12-11;$;;;;False;;;;;;
Custom Denim Factory Raw Selvedge Denim Baggy Jeans Men Slim Fit Bootcut 15oz Japanese Style Salvage Denim Pants;28.0;;;0;https://www.alibaba.com/product-detail/Custom-Denim-Factory-Raw-Selvedge-Denim_1601448332683.html?s=p;4;Alibaba;2025-12-11;$;;;;True;;;;;;
Mid Waist Women's Formal Dress Pants Knitted Breathable Quick Dry Back Hidden Zipper Summer;8.0;;;0;https://www.alibaba.com/product-detail/Mid-Waist-Women-s-Formal-Dress_10000029329725.html;4;Alibaba;2025-12-11;$;;;;False;;;;;;
Custom Streetwear Flare Canvas Lightweight French Terry Cotton Grey Baggy Distressed Wide Leg Men Sweat Pants;16.35;;;0;https://www.alibaba.com/product-detail/Custom-Streetwear-Flare-Canvas-Lightweight-French_1601548502827.html?s=p;4;Alibaba;2025-12-11;$;;;;False;;;;;;
Oversized Formal Dress Pants Women Casual Office Business Dress Pants Breathable Plus Size Fashionable Dress Pant;6.0;;;0;https://www.alibaba.com/product-detail/Oversized-Formal-Dress-Pants-Women-Casual_10000019363119.html;4;Alibaba;2025-12-11;$;;;;False;;;;;;
Distressed Old Custom Ripped Men's Jeans Color Faded Washed Mens Cargo Pants Denim Vintage Double Knee Carpenter Pants Jean Men;13.99;;;0;https://www.alibaba.com/product-detail/Distressed-Old-Custom-Ripped-Men-s_1601259143409.html?s=p;4;Alibaba;2025-12-11;$;;;;True;;;;;;
Summer Drop Sense of Solid Color Small Dress Pants Men's British Slim Feet Casual Pants Business Long Suit Pants;7.85;;;0;https://www.alibaba.com/product-detail/Summer-Drop-Sense-of-Solid-Color_1600990844693.html;4;Alibaba;2025-12-11;$;;;;True;;;;;;
Custom Logo 100% Cotton Streetwear Joggers Casual Mid Waist Sports Pants With Side Stripe Flat Front Flare OEM Service;12.78;;;0;https://www.alibaba.com/product-detail/Custom-Logo-100-Cotton-Streetwear-Joggers_1601280515993.html?s=p;4;Alibaba;2025-12-11;$;;;;False;;;;;;
Wholesale Men Suit Pants Dress Pants Slim Fit Stretch Casual Formal Wear Business Male Trouser;6.7;;;0;https://www.alibaba.com/product-detail/Wholesale-Men-Suit-Pants-Dress-Pants_1600949312157.html;4;Alibaba;2025-12-11;$;;;;False;;;;;;
Top Quality 4-Way Stretch Riding Pants Phone Pocket Equestrian Breeches Man Fashion New Styles Workout Horse Riding Clothing;24.0;;;0;https://www.alibaba.com/product-detail/Top-Quality-4-Way-Stretch-Riding_1601630620309.html?s=p;4;Alibaba;2025-12-11;$;;;;False;;;;;;
Waffle Casual Dress Pants Men Spring and Autumn Business Formal Suit Pants Slim Feet Non-ironing Elastic Waist Suit Pants;6.65;;;0;https://www.alibaba.com/product-detail/Waffle-Casual-Dress-Pants-Men-Spring_1601388507840.html;4;Alibaba;2025-12-11;$;;;;False;;;;;;
Custom Manufacturer's Unisex 100% Cotton Vintage Acid Washed Sweatpants Men's Casual Stripe Track Pants;18.0;;;0;https://www.alibaba.com/product-detail/Custom-Manufacturer-s-Unisex-100-Cotton_1601346787864.html?s=p;4;Alibaba;2025-12-11;$;;;;False;;;;;;
Popular New Casual Dress Pants Solid Color Nine-point Pants Fashion Men's Dress Pants;7.85;;;0;https://www.alibaba.com/product-detail/Popular-New-Casual-Dress-Pants-Solid_1601396301857.html;4;Alibaba;2025-12-11;$;;;;False;;;;;;
Wholesale Gym Slim Fit Track Pants Custom Mens Fashion French Terry Short SweatPants;9.8;;;0;https://www.alibaba.com/product-detail/Wholesale-Gym-Slim-Fit-Track-Pants_1600353951078.html?s=p;4;Alibaba;2025-12-11;$;;;;True;;;;;;
Durable Women Dress Pant in Soft Fabric and High Quality Material Best for Daily Use Quick Dry Breathable Women Dress Pant;8.0;;;0;https://www.alibaba.com/product-detail/Durable-Women-Dress-Pant-in-Soft_11000021548604.html;4;Alibaba;2025-12-11;$;;;;False;;;;;;
Fashion Woman Outfits Color Patchwork Long Sleeve Zip Up Crop Top And Pants 2 Pieces Set;9.94;;;0;https://www.alibaba.com/product-detail/Fashion-Woman-Outfits-Color-Patchwork-Long_1601594708282.html?s=p;4;Alibaba;2025-12-11;$;;;;True;;;;;;
TONGYANG Men's Suit Pants Formal Trousers Stretch Slim Solid Color Casual Dress Pants Fashion Pencil Business Pants for Men;16.8;;;0;https://www.alibaba.com/product-detail/TONGYANG-Men-s-Suit-Pants-Formal_1601514198669.html;4;Alibaba;2025-12-11;$;;;;False;;;;;;
High Quality Screen Printed Sun Faded Vintage Fleece Jogger Sweatpants Custom Heavy Weight Cotton Straight Leg Men's Sweat Pants;28.8;;;0;https://www.alibaba.com/product-detail/High-Quality-Screen-Printed-Sun-Faded_1601613107128.html?s=p;4;Alibaba;2025-12-11;$;;;;True;;;;;;
Old-style Luxury Men's Dress Trousers Wool Blend Slim Fit Suit Pants Flat Front Design for Formal Occasions Brand Customization;33.6;;;0;https://www.alibaba.com/product-detail/Old-style-Luxury-Men-s-Dress_1601608044449.html;4;Alibaba;2025-12-11;$;;;;True;;;;;;
Safety Pants Multi Pocket Elastic Waist Cargo Pants Mens Workwear Trousers Fr Cargo Safety Work Flame Retardant Pants;22.0;;;0;https://www.alibaba.com/product-detail/Safety-Pants-Multi-Pocket-Elastic-Waist_1600196309438.html?s=p;4;Alibaba;2025-12-11;$;;;;True;;;;;;
2025 Men's Luxurious Slim Fit Office Formal Dress Trousers Pants High Quality Stretchable Formal Straight Pattern Chino Trouser;12.0;;;0;https://www.alibaba.com/product-detail/2025-Men-s-Luxurious-Slim-Fit_10000028744124.html;4;Alibaba;2025-12-11;$;;;;False;;;;;;
Hot-selling Heat-resistant Welding Work Clothes, Workshop Uniforms, Electrician Work Jackets And Pants;12.17;;;0;https://www.alibaba.com/product-detail/Hot-selling-Heat-resistant-Welding-Work_1601590887119.html?s=p;4;Alibaba;2025-12-11;$;;;;True;;;;;;
High Quality Formal Dress Pants Straight High Waist Slim Suit Trousers Business Wholesale Trouser for Men ODM;11.0;;;0;https://www.alibaba.com/product-detail/High-Quality-Formal-Dress-Pants-Straight_1601580989923.html;4;Alibaba;2025-12-11;$;;;;False;;;;;;
New Trendy Style Unisex Stretch Fabric Flare Pants Breathable Hospital Women Scrub Sets Comfortable Surgical Nurse Uniform Set;8.0;;;0;https://www.alibaba.com/product-detail/New-Trendy-Style-Unisex-Stretch-Fabric_1601265620834.html?s=p;4;Alibaba;2025-12-11;$;;;;False;;;;;;
Men's Professional Slim Fit Dress Pants High Elasticity Business Formal Casual Trousers for Spring Summer Mid Thin Ice Straight;3.54;;;0;https://www.alibaba.com/product-detail/Men-s-Professional-Slim-Fit-Dress_1601566878484.html;4;Alibaba;2025-12-11;$;;;;True;;;;;;
Hot Sale Tech Joggers Black Fitness Men Jogger Pants Gym Jogger;11.0;;;0;https://www.alibaba.com/product-detail/Hot-Sale-Tech-Joggers-Black-Fitness_60823848638.html?s=p;4;Alibaba;2025-12-11;$;;;;True;;;;;;
2024 New Fashion Custom Pants Men Wholesale Dress Suit Pants Official Wear Suiting Men or Men Pant Office OEM Support Oem;7.7;;;0;https://www.alibaba.com/product-detail/2024-New-Fashion-Custom-Pants-Men_11000012902834.html;4;Alibaba;2025-12-11;$;;;;False;;;;;;
RTS In Stock Baby Kids Toddler Girls Fall Winter Denim Flare Pants Bell Bottom Jeans Customized Clothes;8.59;;;0;https://www.alibaba.com/product-detail/RTS-In-Stock-Baby-Kids-Toddler_1601227850019.html?s=p;4;Alibaba;2025-12-11;$;;;;True;;;;;;
Factory Direct Customizable Women's Straight Pants Office Dress Pants Comfortable Breathable Suit Pants;18.75;;;0;https://www.alibaba.com/product-detail/Factory-Direct-Customizable-Women-s-Straight_1601541620677.html;4;Alibaba;2025-12-11;$;;;;False;;;;;;
Fashion Two Washed Denim Jacket And Pants 2 Pieces Set For 2025 Fall Woman Casual Stretch Jeans 2piece Sets;15.86;;;0;https://www.alibaba.com/product-detail/Fashion-Two-Washed-Denim-Jacket-And_1601587307458.html?s=p;4;Alibaba;2025-12-11;$;;;;True;;;;;;
High Quality Fun John Summer Bamboo Blend Breathable Anti-Wrinkle Business Men Women Royal Blue Navy Color Pants Office Formal;14.0;;;0;https://www.alibaba.com/product-detail/High-Quality-Fun-John-Summer-Bamboo_1601211413559.html;4;Alibaba;2025-12-11;$;;;;False;;;;;;
Design Printed Baseball Uniform Sports Team Custom Style Sublimated Baseball Wear Softball Pants;14.0;;;0;https://www.alibaba.com/product-detail/Design-Printed-Baseball-Uniform-Sports-Team_1601214507032.html?s=p;4;Alibaba;2025-12-11;$;;;;False;;;;;;
2025 New Men's Slim Fit Stripe Dress Pants Business Formal Casual Office Trousers Skinny Suit Plus Size Stylish Fabric Design;6.5;;;0;https://www.alibaba.com/product-detail/2025-New-Men-s-Slim-Fit_1601526245335.html;4;Alibaba;2025-12-11;$;;;;True;;;;;;
Hot Sale RTS Western Style Long-sleeved Long Pants Set Bulk Wholesale Latest Design Milk Silk Custom Print Comfortable Set;5.95;;;0;https://www.alibaba.com/product-detail/Hot-Sale-RTS-Western-Style-Long_1601643754230.html?s=p;4;Alibaba;2025-12-11;$;;;;False;;;;;;
WN-021 Classic Business Casual Formal Wear Black Mens Plaid Pants Men's Dress Pants Slim Casual Dress Suit Pants;14.5;;;0;https://www.alibaba.com/product-detail/WN-021-Classic-Business-Casual-Formal_1601288830720.html;4;Alibaba;2025-12-11;$;;;;False;;;;;;
Raincoat Rain Pants Suit Full Body Motorcycle Riding Reflective Split Raincoat Suit Outdoor Waterproof Rain Coat For Men Women;4.78;;;0;https://www.alibaba.com/product-detail/Raincoat-Rain-Pants-Suit-Full-Body_1601053610723.html?s=p;4;Alibaba;2025-12-11;$;;;;False;;;;;;
OEM Custom Men's Casual Dress Pants High Quality Canvas Fabric Lightweight Straight Online Wholesale Price Dress Pant Sale;10.0;;;0;https://www.alibaba.com/product-detail/OEM-Custom-Men-s-Casual-Dress_10000030840637.html;4;Alibaba;2025-12-11;$;;;;False;;;;;;
Men's Cargo Work Pants Patchwork Two Tone Lightweight Outdoor Work Hiking Pants With Multi Pockets;8.0;;;0;https://www.alibaba.com/product-detail/Men-s-Cargo-Work-Pants-Patchwork_1601587381818.html?s=p;4;Alibaba;2025-12-11;$;;;;True;;;;;;
Best Supplier Good Selling Plain Dyed Dress Pants For Sale / OEM Service High Demanded Product Dress Pant;12.0;;;0;https://www.alibaba.com/product-detail/Best-Supplier-Good-Selling-Plain-Dyed_11000021769285.html;4;Alibaba;2025-12-11;$;;;;False;;;;;;
2024 Early Autumn All-Match Trendy Loose Casual Pants Men Women XL Size 100% Cotton Mid-Waist Wide Leg Heavy Solid Color Worsted;9.7;;;0;https://www.alibaba.com/product-detail/2024-Early-Autumn-All-Match-Trendy_1601453713855.html?s=p;4;Alibaba;2025-12-11;$;;;;False;;;;;;
Custom Factory Wrinkle-Free Causal Business Dress Trousers Gurkha Naples Italian Style Pleated Chino Suit Pants;4.1;;;0;https://www.alibaba.com/product-detail/Custom-Factory-Wrinkle-Free-Causal-Business_1601616803461.html;4;Alibaba;2025-12-11;$;;;;False;;;;;;
Stretch Wholesale Custom High Quality Electrician Safety Work Pants With Multiple Pockets;26.4;;;0;https://www.alibaba.com/product-detail/Stretch-Wholesale-Custom-High-Quality-Electrician_1601083421411.html?s=p;4;Alibaba;2025-12-11;$;;;;True;;;;;;
Customized Man Elegant Comfortable Men's Dress Trousers Cotton Chino Slim Fit Tapered Chinos Formal Pants for Men;5.28;;;0;https://www.alibaba.com/product-detail/Customized-Man-Elegant-Comfortable-Men-s_1600387597369.html;4;Alibaba;2025-12-11;$;;;;False;;;;;;
Outdoor Wear Green Blue Black Plus Size Waterproof Packable Men's Rainsuit Workwear Custom Raincoat Pants And Jacket;3.29;;;0;https://www.alibaba.com/product-detail/Outdoor-Wear-Green-Blue-Black-Plus_1600545942698.html?s=p;4;Alibaba;2025-12-11;$;;;;False;;;;;;
New Fashionable Plus Size Formal Dress Pants Men's Breathable Wholesale Casual Slim Business Pant Outdoor Wear Custom Logo Waist;20.0;;;0;https://www.alibaba.com/product-detail/New-Fashionable-Plus-Size-Formal-Dress_10000031083446.html;4;Alibaba;2025-12-11;$;;;;False;;;;;;
Wholesale Summer Clothing Classic Shorts Casual Men Pants;9.8;;;0;https://www.alibaba.com/product-detail/Wholesale-Summer-Clothing-Classic-Shorts-Casual_1600434413302.html?s=p;4;Alibaba;2025-12-11;$;;;;True;;;;;;
Plus Size Mens Dress Pants Oversized Loose Stretch Wrinkle Free Straight Trousers Office Clothes Business Suit Work Pants;11.92;;;0;https://www.alibaba.com/product-detail/Plus-Size-Mens-Dress-Pants-Oversized_1600858732324.html;4;Alibaba;2025-12-11;$;;;;False;;;;;;
High-Rise Slim Straight Jeans With Heavy Fading & Distressed Pockets 10 Oz Superstretch Light Blue Women's Five-Pocket Denim;16.3;;;0;https://www.alibaba.com/product-detail/High-Rise-Slim-Straight-Jeans-With_1601203803219.html?s=p;4;Alibaba;2025-12-11;$;;;;False;;;;;;
